/Users/dongchen/Documents/AI-project/GitHub/ppsupertrend/venv/lib/python3.9/site-packages/urllib3/__init__.py:35: NotOpenSSLWarning: urllib3 v2 only supports OpenSSL 1.1.1+, currently the 'ssl' module is compiled with 'LibreSSL 2.8.3'. See: https://github.com/urllib3/urllib3/issues/3020
  warnings.warn(
2026-01-09 14:07:54,834 - INFO - Downloading EUR_USD data for timeframes: ['M5', 'H3']
2026-01-09 14:07:54,834 - INFO - Downloading EUR_USD data for timeframes: ['M5', 'H3']
2026-01-09 14:07:54,834 - INFO - 
--- Downloading M5 data ---
2026-01-09 14:07:54,834 - INFO - 
--- Downloading M5 data ---
2026-01-09 14:07:54,835 - INFO - Loading cached data from backtest/data/EUR_USD_M5_20251210_20260109.csv
2026-01-09 14:07:54,835 - INFO - Loading cached data from backtest/data/EUR_USD_M5_20251210_20260109.csv
2026-01-09 14:07:54,856 - INFO - ✓ M5: 4999 candles
2026-01-09 14:07:54,856 - INFO - ✓ M5: 4999 candles
2026-01-09 14:07:54,857 - INFO - 
--- Downloading H3 data ---
2026-01-09 14:07:54,857 - INFO - 
--- Downloading H3 data ---
2026-01-09 14:07:54,857 - INFO - Loading cached data from backtest/data/EUR_USD_H3_20251210_20260109.csv
2026-01-09 14:07:54,857 - INFO - Loading cached data from backtest/data/EUR_USD_H3_20251210_20260109.csv
2026-01-09 14:07:54,858 - INFO - ✓ H3: 239 candles
2026-01-09 14:07:54,858 - INFO - ✓ H3: 239 candles

==================================================
DOWNLOAD SUMMARY
==================================================
M5: 4999 candles (2025-12-15 13:05:00+00:00 to 2026-01-09 21:35:00+00:00)
H3: 239 candles (2025-11-26 22:00:00+00:00 to 2026-01-09 16:00:00+00:00)
/Users/dongchen/Documents/AI-project/GitHub/ppsupertrend/venv/lib/python3.9/site-packages/urllib3/__init__.py:35: NotOpenSSLWarning: urllib3 v2 only supports OpenSSL 1.1.1+, currently the 'ssl' module is compiled with 'LibreSSL 2.8.3'. See: https://github.com/urllib3/urllib3/issues/3020
  warnings.warn(
2026-01-09 14:07:55,120 - INFO - Downloading EUR_USD data for timeframes: ['M5', 'H3']
2026-01-09 14:07:55,120 - INFO - Downloading EUR_USD data for timeframes: ['M5', 'H3']
2026-01-09 14:07:55,120 - INFO - 
--- Downloading M5 data ---
2026-01-09 14:07:55,120 - INFO - 
--- Downloading M5 data ---
2026-01-09 14:07:55,120 - INFO - Loading cached data from backtest/data/EUR_USD_M5_20251210_20260109.csv
2026-01-09 14:07:55,120 - INFO - Loading cached data from backtest/data/EUR_USD_M5_20251210_20260109.csv
2026-01-09 14:07:55,136 - INFO - ✓ M5: 4999 candles
2026-01-09 14:07:55,136 - INFO - ✓ M5: 4999 candles
2026-01-09 14:07:55,136 - INFO - 
--- Downloading H3 data ---
2026-01-09 14:07:55,136 - INFO - 
--- Downloading H3 data ---
2026-01-09 14:07:55,136 - INFO - Loading cached data from backtest/data/EUR_USD_H3_20251210_20260109.csv
2026-01-09 14:07:55,136 - INFO - Loading cached data from backtest/data/EUR_USD_H3_20251210_20260109.csv
2026-01-09 14:07:55,138 - INFO - ✓ H3: 239 candles
2026-01-09 14:07:55,138 - INFO - ✓ H3: 239 candles
2026-01-09 14:07:55,141 - INFO - Starting backtest for EUR_USD 5m
2026-01-09 14:07:55,141 - INFO - Starting backtest for EUR_USD 5m
2026-01-09 14:07:55,142 - INFO - Trading data: 4999 candles
2026-01-09 14:07:55,142 - INFO - Trading data: 4999 candles
2026-01-09 14:07:55,142 - INFO - Market data: 239 candles
2026-01-09 14:07:55,142 - INFO - Market data: 239 candles
2026-01-09 14:07:55,142 - INFO - Backtest period: 2025-12-15 13:05:00+00:00 to 2026-01-09 21:35:00+00:00
2026-01-09 14:07:55,142 - INFO - Backtest period: 2025-12-15 13:05:00+00:00 to 2026-01-09 21:35:00+00:00
2026-01-09 14:07:55,142 - INFO - Calculating indicators...
2026-01-09 14:07:55,142 - INFO - Calculating indicators...
2026-01-09 14:07:57,964 - INFO - ⚠️  Skipping SHORT trade: disable_opposite_trade enabled and market trend is BULL
2026-01-09 14:07:58,070 - INFO - Market-aware position sizing:
2026-01-09 14:07:58,070 - INFO -   Market trend: BULL, Position: LONG
2026-01-09 14:07:58,070 - INFO -   Risk amount: $300.00
2026-01-09 14:07:58,070 - INFO -   Position size: 269834 units (2.698 lots)
2026-01-09 14:07:58,070 - INFO -   Actual risk: $300.00
2026-01-09 14:07:58,070 - INFO -   Stop distance: 0.00111 (11.1 pips)
2026-01-09 14:07:58,070 - INFO - OPENED LONG | Price: 1.17490 | SL: 1.17369 | TP: 1.17611 | Size: 269,834 | Market: BULL
2026-01-09 14:07:58,070 - INFO - OPENED LONG | Price: 1.17490 | SL: 1.17369 | TP: 1.17611 | Size: 269,834 | Market: BULL
2026-01-09 14:07:58,336 - INFO - 🔄 Trend reversal: Closing LONG position only (disable_opposite_trade prevents SHORT in BULL market)
2026-01-09 14:07:58,337 - INFO - CLOSED LONG | P/L: $43.17 | Reason: OPPOSITE_TRADE_DISABLED | Duration: 300m
2026-01-09 14:07:58,337 - INFO - CLOSED LONG | P/L: $43.17 | Reason: OPPOSITE_TRADE_DISABLED | Duration: 300m
2026-01-09 14:07:58,490 - INFO - Market-aware position sizing:
2026-01-09 14:07:58,490 - INFO -   Market trend: BULL, Position: LONG
2026-01-09 14:07:58,490 - INFO -   Risk amount: $300.00
2026-01-09 14:07:58,490 - INFO -   Position size: 275956 units (2.760 lots)
2026-01-09 14:07:58,490 - INFO -   Actual risk: $300.00
2026-01-09 14:07:58,490 - INFO -   Stop distance: 0.00109 (10.9 pips)
2026-01-09 14:07:58,490 - INFO - OPENED LONG | Price: 1.17586 | SL: 1.17467 | TP: 1.17705 | Size: 275,956 | Market: BULL
2026-01-09 14:07:58,490 - INFO - OPENED LONG | Price: 1.17586 | SL: 1.17467 | TP: 1.17705 | Size: 275,956 | Market: BULL
2026-01-09 14:07:58,647 - INFO - 🔄 Trend reversal: Closing LONG position only (disable_opposite_trade prevents SHORT in BULL market)
2026-01-09 14:07:58,647 - INFO - CLOSED LONG | P/L: $-289.75 | Reason: OPPOSITE_TRADE_DISABLED | Duration: 195m
2026-01-09 14:07:58,647 - INFO - CLOSED LONG | P/L: $-289.75 | Reason: OPPOSITE_TRADE_DISABLED | Duration: 195m
2026-01-09 14:07:58,751 - INFO - Market-aware position sizing:
2026-01-09 14:07:58,751 - INFO -   Market trend: BULL, Position: LONG
2026-01-09 14:07:58,751 - INFO -   Risk amount: $300.00
2026-01-09 14:07:58,751 - INFO -   Position size: 262750 units (2.627 lots)
2026-01-09 14:07:58,751 - INFO -   Actual risk: $300.00
2026-01-09 14:07:58,751 - INFO -   Stop distance: 0.00114 (11.4 pips)
2026-01-09 14:07:58,751 - INFO - OPENED LONG | Price: 1.17565 | SL: 1.17441 | TP: 1.17689 | Size: 262,750 | Market: BULL
2026-01-09 14:07:58,751 - INFO - OPENED LONG | Price: 1.17565 | SL: 1.17441 | TP: 1.17689 | Size: 262,750 | Market: BULL
2026-01-09 14:07:58,962 - INFO - CLOSED LONG | P/L: $326.27 | Reason: TAKE_PROFIT | Duration: 290m
2026-01-09 14:07:58,962 - INFO - CLOSED LONG | P/L: $326.27 | Reason: TAKE_PROFIT | Duration: 290m
2026-01-09 14:07:59,169 - INFO - ⚠️  Skipping SHORT trade: disable_opposite_trade enabled and market trend is BULL
2026-01-09 14:07:59,382 - INFO - Market-aware position sizing:
2026-01-09 14:07:59,382 - INFO -   Market trend: BULL, Position: LONG
2026-01-09 14:07:59,382 - INFO -   Risk amount: $300.00
2026-01-09 14:07:59,382 - INFO -   Position size: 156077 units (1.561 lots)
2026-01-09 14:07:59,382 - INFO -   Actual risk: $300.00
2026-01-09 14:07:59,382 - INFO -   Stop distance: 0.00192 (19.2 pips)
2026-01-09 14:07:59,382 - INFO - OPENED LONG | Price: 1.17618 | SL: 1.17416 | TP: 1.17820 | Size: 156,077 | Market: BULL
2026-01-09 14:07:59,382 - INFO - OPENED LONG | Price: 1.17618 | SL: 1.17416 | TP: 1.17820 | Size: 156,077 | Market: BULL
2026-01-09 14:07:59,386 - INFO - 🔄 Trend reversal: Closing LONG position only (disable_opposite_trade prevents SHORT in BULL market)
2026-01-09 14:07:59,387 - INFO - CLOSED LONG | P/L: $-218.51 | Reason: OPPOSITE_TRADE_DISABLED | Duration: 50m
2026-01-09 14:07:59,387 - INFO - CLOSED LONG | P/L: $-218.51 | Reason: OPPOSITE_TRADE_DISABLED | Duration: 50m
2026-01-09 14:08:00,124 - INFO - Market-aware position sizing:
2026-01-09 14:08:00,124 - INFO -   Market trend: BULL, Position: LONG
2026-01-09 14:08:00,124 - INFO -   Risk amount: $300.00
2026-01-09 14:08:00,124 - INFO -   Position size: 170013 units (1.700 lots)
2026-01-09 14:08:00,124 - INFO -   Actual risk: $300.00
2026-01-09 14:08:00,124 - INFO -   Stop distance: 0.00176 (17.6 pips)
2026-01-09 14:08:00,124 - INFO - OPENED LONG | Price: 1.17252 | SL: 1.17066 | TP: 1.17438 | Size: 170,013 | Market: BULL
2026-01-09 14:08:00,124 - INFO - OPENED LONG | Price: 1.17252 | SL: 1.17066 | TP: 1.17438 | Size: 170,013 | Market: BULL
2026-01-09 14:08:00,176 - INFO - 🔄 Trend reversal: Closing LONG position only (disable_opposite_trade prevents SHORT in BULL market)
2026-01-09 14:08:00,176 - INFO - CLOSED LONG | P/L: $-251.62 | Reason: OPPOSITE_TRADE_DISABLED | Duration: 40m
2026-01-09 14:08:00,176 - INFO - CLOSED LONG | P/L: $-251.62 | Reason: OPPOSITE_TRADE_DISABLED | Duration: 40m
2026-01-09 14:08:00,231 - INFO - Market-aware position sizing:
2026-01-09 14:08:00,231 - INFO -   Market trend: BULL, Position: LONG
2026-01-09 14:08:00,231 - INFO -   Risk amount: $300.00
2026-01-09 14:08:00,231 - INFO -   Position size: 150506 units (1.505 lots)
2026-01-09 14:08:00,231 - INFO -   Actual risk: $300.00
2026-01-09 14:08:00,231 - INFO -   Stop distance: 0.00199 (19.9 pips)
2026-01-09 14:08:00,231 - INFO - OPENED LONG | Price: 1.17266 | SL: 1.17057 | TP: 1.17475 | Size: 150,506 | Market: BULL
2026-01-09 14:08:00,231 - INFO - OPENED LONG | Price: 1.17266 | SL: 1.17057 | TP: 1.17475 | Size: 150,506 | Market: BULL
2026-01-09 14:08:00,386 - INFO - CLOSED LONG | P/L: $315.05 | Reason: TAKE_PROFIT | Duration: 135m
2026-01-09 14:08:00,386 - INFO - CLOSED LONG | P/L: $315.05 | Reason: TAKE_PROFIT | Duration: 135m
2026-01-09 14:08:00,546 - INFO - ⚠️  Skipping SHORT trade: disable_opposite_trade enabled and market trend is BULL
2026-01-09 14:08:00,856 - INFO - Market-aware position sizing:
2026-01-09 14:08:00,857 - INFO -   Market trend: BULL, Position: LONG
2026-01-09 14:08:00,857 - INFO -   Risk amount: $300.00
2026-01-09 14:08:00,857 - INFO -   Position size: 514469 units (5.145 lots)
2026-01-09 14:08:00,857 - INFO -   Actual risk: $300.00
2026-01-09 14:08:00,857 - INFO -   Stop distance: 0.00058 (5.8 pips)
2026-01-09 14:08:00,857 - INFO - OPENED LONG | Price: 1.17454 | SL: 1.17386 | TP: 1.17522 | Size: 514,469 | Market: BULL
2026-01-09 14:08:00,857 - INFO - OPENED LONG | Price: 1.17454 | SL: 1.17386 | TP: 1.17522 | Size: 514,469 | Market: BULL
2026-01-09 14:08:00,909 - INFO - 🔄 Trend reversal: Closing LONG position only (disable_opposite_trade prevents SHORT in BULL market)
2026-01-09 14:08:00,909 - INFO - CLOSED LONG | P/L: $-318.97 | Reason: OPPOSITE_TRADE_DISABLED | Duration: 50m
2026-01-09 14:08:00,909 - INFO - CLOSED LONG | P/L: $-318.97 | Reason: OPPOSITE_TRADE_DISABLED | Duration: 50m
2026-01-09 14:08:01,116 - INFO - Market-aware position sizing:
2026-01-09 14:08:01,116 - INFO -   Market trend: BULL, Position: LONG
2026-01-09 14:08:01,116 - INFO -   Risk amount: $300.00
2026-01-09 14:08:01,116 - INFO -   Position size: 416744 units (4.167 lots)
2026-01-09 14:08:01,116 - INFO -   Actual risk: $300.00
2026-01-09 14:08:01,116 - INFO -   Stop distance: 0.00072 (7.2 pips)
2026-01-09 14:08:01,116 - INFO - OPENED LONG | Price: 1.17442 | SL: 1.17360 | TP: 1.17524 | Size: 416,744 | Market: BULL
2026-01-09 14:08:01,116 - INFO - OPENED LONG | Price: 1.17442 | SL: 1.17360 | TP: 1.17524 | Size: 416,744 | Market: BULL
2026-01-09 14:08:01,224 - INFO - CLOSED LONG | P/L: $-341.67 | Reason: STOP_LOSS | Duration: 165m
2026-01-09 14:08:01,224 - INFO - CLOSED LONG | P/L: $-341.67 | Reason: STOP_LOSS | Duration: 165m
2026-01-09 14:08:01,224 - INFO - ⚠️  Skipping SHORT trade: disable_opposite_trade enabled and market trend is BULL
2026-01-09 14:08:01,540 - INFO - Market-aware position sizing:
2026-01-09 14:08:01,540 - INFO -   Market trend: BULL, Position: LONG
2026-01-09 14:08:01,540 - INFO -   Risk amount: $300.00
2026-01-09 14:08:01,540 - INFO -   Position size: 139911 units (1.399 lots)
2026-01-09 14:08:01,540 - INFO -   Actual risk: $300.00
2026-01-09 14:08:01,540 - INFO -   Stop distance: 0.00214 (21.4 pips)
2026-01-09 14:08:01,540 - INFO - OPENED LONG | Price: 1.17350 | SL: 1.17126 | TP: 1.17574 | Size: 139,911 | Market: BULL
2026-01-09 14:08:01,540 - INFO - OPENED LONG | Price: 1.17350 | SL: 1.17126 | TP: 1.17574 | Size: 139,911 | Market: BULL
2026-01-09 14:08:01,657 - INFO - 🔄 Trend reversal: Closing LONG position only (disable_opposite_trade prevents SHORT in BULL market)
2026-01-09 14:08:01,657 - INFO - CLOSED LONG | P/L: $-239.25 | Reason: OPPOSITE_TRADE_DISABLED | Duration: 135m
2026-01-09 14:08:01,657 - INFO - CLOSED LONG | P/L: $-239.25 | Reason: OPPOSITE_TRADE_DISABLED | Duration: 135m
2026-01-09 14:08:01,922 - INFO - Market-aware position sizing:
2026-01-09 14:08:01,922 - INFO -   Market trend: BULL, Position: LONG
2026-01-09 14:08:01,922 - INFO -   Risk amount: $300.00
2026-01-09 14:08:01,922 - INFO -   Position size: 289317 units (2.893 lots)
2026-01-09 14:08:01,922 - INFO -   Actual risk: $300.00
2026-01-09 14:08:01,922 - INFO -   Stop distance: 0.00104 (10.4 pips)
2026-01-09 14:08:01,922 - INFO - OPENED LONG | Price: 1.17276 | SL: 1.17162 | TP: 1.17390 | Size: 289,317 | Market: BULL
2026-01-09 14:08:01,922 - INFO - OPENED LONG | Price: 1.17276 | SL: 1.17162 | TP: 1.17390 | Size: 289,317 | Market: BULL
2026-01-09 14:08:02,028 - INFO - 🔄 Trend reversal: Closing LONG position only (disable_opposite_trade prevents SHORT in BULL market)
2026-01-09 14:08:02,028 - INFO - CLOSED LONG | P/L: $-211.20 | Reason: OPPOSITE_TRADE_DISABLED | Duration: 120m
2026-01-09 14:08:02,028 - INFO - CLOSED LONG | P/L: $-211.20 | Reason: OPPOSITE_TRADE_DISABLED | Duration: 120m
2026-01-09 14:08:02,081 - INFO - Market-aware position sizing:
2026-01-09 14:08:02,081 - INFO -   Market trend: BULL, Position: LONG
2026-01-09 14:08:02,081 - INFO -   Risk amount: $300.00
2026-01-09 14:08:02,081 - INFO -   Position size: 439895 units (4.399 lots)
2026-01-09 14:08:02,081 - INFO -   Actual risk: $300.00
2026-01-09 14:08:02,081 - INFO -   Stop distance: 0.00068 (6.8 pips)
2026-01-09 14:08:02,081 - INFO - OPENED LONG | Price: 1.17275 | SL: 1.17197 | TP: 1.17353 | Size: 439,895 | Market: BULL
2026-01-09 14:08:02,081 - INFO - OPENED LONG | Price: 1.17275 | SL: 1.17197 | TP: 1.17353 | Size: 439,895 | Market: BULL
2026-01-09 14:08:02,135 - INFO - Progress: 20.0% (1000/4999)
2026-01-09 14:08:02,135 - INFO - Progress: 20.0% (1000/4999)
2026-01-09 14:08:02,189 - INFO - 🔄 Trend reversal: Closing LONG position only (disable_opposite_trade prevents SHORT in BULL market)
2026-01-09 14:08:02,189 - INFO - CLOSED LONG | P/L: $-268.34 | Reason: OPPOSITE_TRADE_DISABLED | Duration: 150m
2026-01-09 14:08:02,189 - INFO - CLOSED LONG | P/L: $-268.34 | Reason: OPPOSITE_TRADE_DISABLED | Duration: 150m
2026-01-09 14:08:02,824 - INFO - Market-aware position sizing:
2026-01-09 14:08:02,824 - INFO -   Market trend: BULL, Position: LONG
2026-01-09 14:08:02,824 - INFO -   Risk amount: $300.00
2026-01-09 14:08:02,824 - INFO -   Position size: 145656 units (1.457 lots)
2026-01-09 14:08:02,824 - INFO -   Actual risk: $300.00
2026-01-09 14:08:02,824 - INFO -   Stop distance: 0.00206 (20.6 pips)
2026-01-09 14:08:02,824 - INFO - OPENED LONG | Price: 1.17194 | SL: 1.16978 | TP: 1.17410 | Size: 145,656 | Market: BULL
2026-01-09 14:08:02,824 - INFO - OPENED LONG | Price: 1.17194 | SL: 1.16978 | TP: 1.17410 | Size: 145,656 | Market: BULL
2026-01-09 14:08:03,194 - INFO - 🔄 Trend reversal: Closing LONG position only (disable_opposite_trade prevents SHORT in BULL market)
2026-01-09 14:08:03,194 - INFO - CLOSED LONG | P/L: $-151.48 | Reason: OPPOSITE_TRADE_DISABLED | Duration: 415m
2026-01-09 14:08:03,194 - INFO - CLOSED LONG | P/L: $-151.48 | Reason: OPPOSITE_TRADE_DISABLED | Duration: 415m
2026-01-09 14:08:03,296 - INFO - Market-aware position sizing:
2026-01-09 14:08:03,297 - INFO -   Market trend: BULL, Position: LONG
2026-01-09 14:08:03,297 - INFO -   Risk amount: $300.00
2026-01-09 14:08:03,297 - INFO -   Position size: 239149 units (2.391 lots)
2026-01-09 14:08:03,297 - INFO -   Actual risk: $300.00
2026-01-09 14:08:03,297 - INFO -   Stop distance: 0.00125 (12.5 pips)
2026-01-09 14:08:03,297 - INFO - OPENED LONG | Price: 1.17196 | SL: 1.17061 | TP: 1.17331 | Size: 239,149 | Market: BULL
2026-01-09 14:08:03,297 - INFO - OPENED LONG | Price: 1.17196 | SL: 1.17061 | TP: 1.17331 | Size: 239,149 | Market: BULL
2026-01-09 14:08:03,352 - INFO - 🔄 Trend reversal: Closing LONG position only (disable_opposite_trade prevents SHORT in BULL market)
2026-01-09 14:08:03,352 - INFO - CLOSED LONG | P/L: $-282.20 | Reason: OPPOSITE_TRADE_DISABLED | Duration: 110m
2026-01-09 14:08:03,352 - INFO - CLOSED LONG | P/L: $-282.20 | Reason: OPPOSITE_TRADE_DISABLED | Duration: 110m
2026-01-09 14:08:03,457 - INFO - Market-aware position sizing:
2026-01-09 14:08:03,457 - INFO -   Market trend: BULL, Position: LONG
2026-01-09 14:08:03,457 - INFO -   Risk amount: $300.00
2026-01-09 14:08:03,457 - INFO -   Position size: 336840 units (3.368 lots)
2026-01-09 14:08:03,457 - INFO -   Actual risk: $300.00
2026-01-09 14:08:03,457 - INFO -   Stop distance: 0.00089 (8.9 pips)
2026-01-09 14:08:03,457 - INFO - OPENED LONG | Price: 1.17182 | SL: 1.17083 | TP: 1.17281 | Size: 336,840 | Market: BULL
2026-01-09 14:08:03,457 - INFO - OPENED LONG | Price: 1.17182 | SL: 1.17083 | TP: 1.17281 | Size: 336,840 | Market: BULL
2026-01-09 14:08:03,717 - INFO - 🔄 Trend reversal: Closing LONG position only (disable_opposite_trade prevents SHORT in BULL market)
2026-01-09 14:08:03,717 - INFO - CLOSED LONG | P/L: $-60.63 | Reason: OPPOSITE_TRADE_DISABLED | Duration: 265m
2026-01-09 14:08:03,717 - INFO - CLOSED LONG | P/L: $-60.63 | Reason: OPPOSITE_TRADE_DISABLED | Duration: 265m
2026-01-09 14:08:03,771 - INFO - Market-aware position sizing:
2026-01-09 14:08:03,771 - INFO -   Market trend: BULL, Position: LONG
2026-01-09 14:08:03,771 - INFO -   Risk amount: $300.00
2026-01-09 14:08:03,771 - INFO -   Position size: 271587 units (2.716 lots)
2026-01-09 14:08:03,771 - INFO -   Actual risk: $300.00
2026-01-09 14:08:03,771 - INFO -   Stop distance: 0.00110 (11.0 pips)
2026-01-09 14:08:03,771 - INFO - OPENED LONG | Price: 1.17233 | SL: 1.17113 | TP: 1.17353 | Size: 271,587 | Market: BULL
2026-01-09 14:08:03,771 - INFO - OPENED LONG | Price: 1.17233 | SL: 1.17113 | TP: 1.17353 | Size: 271,587 | Market: BULL
2026-01-09 14:08:03,825 - INFO - CLOSED LONG | P/L: $327.16 | Reason: TAKE_PROFIT | Duration: 80m
2026-01-09 14:08:03,825 - INFO - CLOSED LONG | P/L: $327.16 | Reason: TAKE_PROFIT | Duration: 80m
2026-01-09 14:08:04,239 - INFO - ⚠️  Skipping SHORT trade: disable_opposite_trade enabled and market trend is BULL
2026-01-09 14:08:04,496 - INFO - Market-aware position sizing:
2026-01-09 14:08:04,496 - INFO -   Market trend: BULL, Position: LONG
2026-01-09 14:08:04,496 - INFO -   Risk amount: $300.00
2026-01-09 14:08:04,496 - INFO -   Position size: 362246 units (3.622 lots)
2026-01-09 14:08:04,496 - INFO -   Actual risk: $300.00
2026-01-09 14:08:04,496 - INFO -   Stop distance: 0.00083 (8.3 pips)
2026-01-09 14:08:04,496 - INFO - OPENED LONG | Price: 1.17588 | SL: 1.17495 | TP: 1.17681 | Size: 362,246 | Market: BULL
2026-01-09 14:08:04,496 - INFO - OPENED LONG | Price: 1.17588 | SL: 1.17495 | TP: 1.17681 | Size: 362,246 | Market: BULL
2026-01-09 14:08:04,653 - INFO - CLOSED LONG | P/L: $336.22 | Reason: TAKE_PROFIT | Duration: 200m
2026-01-09 14:08:04,653 - INFO - CLOSED LONG | P/L: $336.22 | Reason: TAKE_PROFIT | Duration: 200m
2026-01-09 14:08:04,965 - INFO - ⚠️  Skipping SHORT trade: disable_opposite_trade enabled and market trend is BULL
2026-01-09 14:08:05,076 - INFO - Market-aware position sizing:
2026-01-09 14:08:05,076 - INFO -   Market trend: BULL, Position: LONG
2026-01-09 14:08:05,076 - INFO -   Risk amount: $300.00
2026-01-09 14:08:05,076 - INFO -   Position size: 226392 units (2.264 lots)
2026-01-09 14:08:05,076 - INFO -   Actual risk: $300.00
2026-01-09 14:08:05,076 - INFO -   Stop distance: 0.00133 (13.3 pips)
2026-01-09 14:08:05,076 - INFO - OPENED LONG | Price: 1.17812 | SL: 1.17669 | TP: 1.17955 | Size: 226,392 | Market: BULL
2026-01-09 14:08:05,076 - INFO - OPENED LONG | Price: 1.17812 | SL: 1.17669 | TP: 1.17955 | Size: 226,392 | Market: BULL
2026-01-09 14:08:05,181 - INFO - CLOSED LONG | P/L: $322.64 | Reason: TAKE_PROFIT | Duration: 120m
2026-01-09 14:08:05,181 - INFO - CLOSED LONG | P/L: $322.64 | Reason: TAKE_PROFIT | Duration: 120m
2026-01-09 14:08:05,337 - INFO - ⚠️  Skipping SHORT trade: disable_opposite_trade enabled and market trend is BULL
2026-01-09 14:08:05,600 - INFO - Market-aware position sizing:
2026-01-09 14:08:05,600 - INFO -   Market trend: BULL, Position: LONG
2026-01-09 14:08:05,600 - INFO -   Risk amount: $300.00
2026-01-09 14:08:05,600 - INFO -   Position size: 261328 units (2.613 lots)
2026-01-09 14:08:05,600 - INFO -   Actual risk: $300.00
2026-01-09 14:08:05,600 - INFO -   Stop distance: 0.00115 (11.5 pips)
2026-01-09 14:08:05,600 - INFO - OPENED LONG | Price: 1.17794 | SL: 1.17669 | TP: 1.17919 | Size: 261,328 | Market: BULL
2026-01-09 14:08:05,600 - INFO - OPENED LONG | Price: 1.17794 | SL: 1.17669 | TP: 1.17919 | Size: 261,328 | Market: BULL
2026-01-09 14:08:05,703 - INFO - CLOSED LONG | P/L: $326.13 | Reason: TAKE_PROFIT | Duration: 90m
2026-01-09 14:08:05,703 - INFO - CLOSED LONG | P/L: $326.13 | Reason: TAKE_PROFIT | Duration: 90m
2026-01-09 14:08:06,065 - INFO - ⚠️  Skipping SHORT trade: disable_opposite_trade enabled and market trend is BULL
2026-01-09 14:08:06,172 - INFO - Market-aware position sizing:
2026-01-09 14:08:06,172 - INFO -   Market trend: BULL, Position: LONG
2026-01-09 14:08:06,172 - INFO -   Risk amount: $300.00
2026-01-09 14:08:06,172 - INFO -   Position size: 262457 units (2.625 lots)
2026-01-09 14:08:06,172 - INFO -   Actual risk: $300.00
2026-01-09 14:08:06,172 - INFO -   Stop distance: 0.00114 (11.4 pips)
2026-01-09 14:08:06,172 - INFO - OPENED LONG | Price: 1.17988 | SL: 1.17864 | TP: 1.18112 | Size: 262,457 | Market: BULL
2026-01-09 14:08:06,172 - INFO - OPENED LONG | Price: 1.17988 | SL: 1.17864 | TP: 1.18112 | Size: 262,457 | Market: BULL
2026-01-09 14:08:06,276 - INFO - 🔄 Trend reversal: Closing LONG position only (disable_opposite_trade prevents SHORT in BULL market)
2026-01-09 14:08:06,276 - INFO - CLOSED LONG | P/L: $-236.21 | Reason: OPPOSITE_TRADE_DISABLED | Duration: 110m
2026-01-09 14:08:06,276 - INFO - CLOSED LONG | P/L: $-236.21 | Reason: OPPOSITE_TRADE_DISABLED | Duration: 110m
2026-01-09 14:08:06,485 - INFO - Progress: 40.0% (2000/4999)
2026-01-09 14:08:06,485 - INFO - Progress: 40.0% (2000/4999)
2026-01-09 14:08:06,900 - INFO - Market-aware position sizing:
2026-01-09 14:08:06,900 - INFO -   Market trend: BULL, Position: LONG
2026-01-09 14:08:06,900 - INFO -   Risk amount: $300.00
2026-01-09 14:08:06,901 - INFO -   Position size: 845891 units (8.459 lots)
2026-01-09 14:08:06,901 - INFO -   Actual risk: $300.00
2026-01-09 14:08:06,901 - INFO -   Stop distance: 0.00035 (3.5 pips)
2026-01-09 14:08:06,901 - INFO - OPENED LONG | Price: 1.17810 | SL: 1.17765 | TP: 1.17855 | Size: 845,891 | Market: BULL
2026-01-09 14:08:06,901 - INFO - OPENED LONG | Price: 1.17810 | SL: 1.17765 | TP: 1.17855 | Size: 845,891 | Market: BULL
2026-01-09 14:08:07,004 - INFO - 🔄 Trend reversal: Closing LONG position only (disable_opposite_trade prevents SHORT in BULL market)
2026-01-09 14:08:07,004 - INFO - CLOSED LONG | P/L: $-236.85 | Reason: OPPOSITE_TRADE_DISABLED | Duration: 100m
2026-01-09 14:08:07,004 - INFO - CLOSED LONG | P/L: $-236.85 | Reason: OPPOSITE_TRADE_DISABLED | Duration: 100m
2026-01-09 14:08:07,057 - INFO - Market-aware position sizing:
2026-01-09 14:08:07,057 - INFO -   Market trend: BULL, Position: LONG
2026-01-09 14:08:07,057 - INFO -   Risk amount: $300.00
2026-01-09 14:08:07,057 - INFO -   Position size: 294642 units (2.946 lots)
2026-01-09 14:08:07,057 - INFO -   Actual risk: $300.00
2026-01-09 14:08:07,057 - INFO -   Stop distance: 0.00102 (10.2 pips)
2026-01-09 14:08:07,057 - INFO - OPENED LONG | Price: 1.17844 | SL: 1.17732 | TP: 1.17956 | Size: 294,642 | Market: BULL
2026-01-09 14:08:07,057 - INFO - OPENED LONG | Price: 1.17844 | SL: 1.17732 | TP: 1.17956 | Size: 294,642 | Market: BULL
2026-01-09 14:08:07,320 - INFO - 🔄 Trend reversal: Closing LONG position only (disable_opposite_trade prevents SHORT in BULL market)
2026-01-09 14:08:07,320 - INFO - CLOSED LONG | P/L: $20.62 | Reason: OPPOSITE_TRADE_DISABLED | Duration: 325m
2026-01-09 14:08:07,320 - INFO - CLOSED LONG | P/L: $20.62 | Reason: OPPOSITE_TRADE_DISABLED | Duration: 325m
2026-01-09 14:08:07,687 - INFO - Market-aware position sizing:
2026-01-09 14:08:07,687 - INFO -   Market trend: BULL, Position: LONG
2026-01-09 14:08:07,687 - INFO -   Risk amount: $300.00
2026-01-09 14:08:07,687 - INFO -   Position size: 226136 units (2.261 lots)
2026-01-09 14:08:07,687 - INFO -   Actual risk: $300.00
2026-01-09 14:08:07,687 - INFO -   Stop distance: 0.00133 (13.3 pips)
2026-01-09 14:08:07,688 - INFO - OPENED LONG | Price: 1.17779 | SL: 1.17636 | TP: 1.17922 | Size: 226,136 | Market: BULL
2026-01-09 14:08:07,688 - INFO - OPENED LONG | Price: 1.17779 | SL: 1.17636 | TP: 1.17922 | Size: 226,136 | Market: BULL
2026-01-09 14:08:07,846 - INFO - CLOSED LONG | P/L: $322.61 | Reason: TAKE_PROFIT | Duration: 165m
2026-01-09 14:08:07,846 - INFO - CLOSED LONG | P/L: $322.61 | Reason: TAKE_PROFIT | Duration: 165m
2026-01-09 14:08:07,955 - INFO - ⚠️  Skipping SHORT trade: disable_opposite_trade enabled and market trend is BULL
2026-01-09 14:08:08,163 - INFO - Market-aware position sizing:
2026-01-09 14:08:08,163 - INFO -   Market trend: BULL, Position: LONG
2026-01-09 14:08:08,163 - INFO -   Risk amount: $300.00
2026-01-09 14:08:08,163 - INFO -   Position size: 277889 units (2.779 lots)
2026-01-09 14:08:08,163 - INFO -   Actual risk: $300.00
2026-01-09 14:08:08,163 - INFO -   Stop distance: 0.00108 (10.8 pips)
2026-01-09 14:08:08,163 - INFO - OPENED LONG | Price: 1.17752 | SL: 1.17634 | TP: 1.17870 | Size: 277,889 | Market: BULL
2026-01-09 14:08:08,163 - INFO - OPENED LONG | Price: 1.17752 | SL: 1.17634 | TP: 1.17870 | Size: 277,889 | Market: BULL
2026-01-09 14:08:08,269 - INFO - 🔄 Trend reversal: Closing LONG position only (disable_opposite_trade prevents SHORT in BULL market)
2026-01-09 14:08:08,269 - INFO - CLOSED LONG | P/L: $-161.18 | Reason: OPPOSITE_TRADE_DISABLED | Duration: 115m
2026-01-09 14:08:08,269 - INFO - CLOSED LONG | P/L: $-161.18 | Reason: OPPOSITE_TRADE_DISABLED | Duration: 115m
2026-01-09 14:08:08,373 - INFO - Market-aware position sizing:
2026-01-09 14:08:08,373 - INFO -   Market trend: BULL, Position: LONG
2026-01-09 14:08:08,373 - INFO -   Risk amount: $300.00
2026-01-09 14:08:08,373 - INFO -   Position size: 244720 units (2.447 lots)
2026-01-09 14:08:08,373 - INFO -   Actual risk: $300.00
2026-01-09 14:08:08,373 - INFO -   Stop distance: 0.00123 (12.3 pips)
2026-01-09 14:08:08,373 - INFO - OPENED LONG | Price: 1.17776 | SL: 1.17643 | TP: 1.17909 | Size: 244,720 | Market: BULL
2026-01-09 14:08:08,373 - INFO - OPENED LONG | Price: 1.17776 | SL: 1.17643 | TP: 1.17909 | Size: 244,720 | Market: BULL
2026-01-09 14:08:08,540 - INFO - 🔄 Trend reversal: Closing LONG position only (disable_opposite_trade prevents SHORT in BULL market)
2026-01-09 14:08:08,540 - INFO - CLOSED LONG | P/L: $-44.05 | Reason: OPPOSITE_TRADE_DISABLED | Duration: 220m
2026-01-09 14:08:08,540 - INFO - CLOSED LONG | P/L: $-44.05 | Reason: OPPOSITE_TRADE_DISABLED | Duration: 220m
2026-01-09 14:08:08,749 - INFO - Market-aware position sizing:
2026-01-09 14:08:08,749 - INFO -   Market trend: BULL, Position: LONG
2026-01-09 14:08:08,749 - INFO -   Risk amount: $300.00
2026-01-09 14:08:08,749 - INFO -   Position size: 198663 units (1.987 lots)
2026-01-09 14:08:08,749 - INFO -   Actual risk: $300.00
2026-01-09 14:08:08,749 - INFO -   Stop distance: 0.00151 (15.1 pips)
2026-01-09 14:08:08,749 - INFO - OPENED LONG | Price: 1.17696 | SL: 1.17535 | TP: 1.17857 | Size: 198,663 | Market: BULL
2026-01-09 14:08:08,749 - INFO - OPENED LONG | Price: 1.17696 | SL: 1.17535 | TP: 1.17857 | Size: 198,663 | Market: BULL
2026-01-09 14:08:08,855 - INFO - CLOSED LONG | P/L: $319.87 | Reason: TAKE_PROFIT | Duration: 115m
2026-01-09 14:08:08,855 - INFO - CLOSED LONG | P/L: $319.87 | Reason: TAKE_PROFIT | Duration: 115m
2026-01-09 14:08:08,963 - INFO - ⚠️  Skipping SHORT trade: disable_opposite_trade enabled and market trend is BULL
2026-01-09 14:08:09,174 - INFO - Market-aware position sizing:
2026-01-09 14:08:09,174 - INFO -   Market trend: BULL, Position: LONG
2026-01-09 14:08:09,175 - INFO -   Risk amount: $300.00
2026-01-09 14:08:09,175 - INFO -   Position size: 175145 units (1.751 lots)
2026-01-09 14:08:09,175 - INFO -   Actual risk: $300.00
2026-01-09 14:08:09,175 - INFO -   Stop distance: 0.00171 (17.1 pips)
2026-01-09 14:08:09,175 - INFO - OPENED LONG | Price: 1.17740 | SL: 1.17559 | TP: 1.17921 | Size: 175,145 | Market: BULL
2026-01-09 14:08:09,175 - INFO - OPENED LONG | Price: 1.17740 | SL: 1.17559 | TP: 1.17921 | Size: 175,145 | Market: BULL
2026-01-09 14:08:09,281 - INFO - 🔄 Trend reversal: Closing LONG position only (disable_opposite_trade prevents SHORT in BULL market)
2026-01-09 14:08:09,281 - INFO - CLOSED LONG | P/L: $-178.65 | Reason: OPPOSITE_TRADE_DISABLED | Duration: 105m
2026-01-09 14:08:09,281 - INFO - CLOSED LONG | P/L: $-178.65 | Reason: OPPOSITE_TRADE_DISABLED | Duration: 105m
2026-01-09 14:08:09,441 - INFO - Market-aware position sizing:
2026-01-09 14:08:09,442 - INFO -   Market trend: BULL, Position: LONG
2026-01-09 14:08:09,442 - INFO -   Risk amount: $300.00
2026-01-09 14:08:09,442 - INFO -   Position size: 271540 units (2.715 lots)
2026-01-09 14:08:09,442 - INFO -   Actual risk: $300.00
2026-01-09 14:08:09,442 - INFO -   Stop distance: 0.00110 (11.0 pips)
2026-01-09 14:08:09,442 - INFO - OPENED LONG | Price: 1.17628 | SL: 1.17508 | TP: 1.17748 | Size: 271,540 | Market: BULL
2026-01-09 14:08:09,442 - INFO - OPENED LONG | Price: 1.17628 | SL: 1.17508 | TP: 1.17748 | Size: 271,540 | Market: BULL
2026-01-09 14:08:09,760 - INFO - CLOSED LONG | P/L: $327.15 | Reason: TAKE_PROFIT | Duration: 385m
2026-01-09 14:08:09,760 - INFO - CLOSED LONG | P/L: $327.15 | Reason: TAKE_PROFIT | Duration: 385m
2026-01-09 14:08:10,082 - INFO - ⚠️  Skipping SHORT trade: disable_opposite_trade enabled and market trend is BULL
2026-01-09 14:08:10,903 - INFO - Progress: 60.0% (3000/4999)
2026-01-09 14:08:10,903 - INFO - Progress: 60.0% (3000/4999)
2026-01-09 14:08:11,547 - INFO - ⚠️  Skipping LONG trade: disable_opposite_trade enabled and market trend is BEAR
2026-01-09 14:08:11,756 - INFO - Market-aware position sizing:
2026-01-09 14:08:11,756 - INFO -   Market trend: BEAR, Position: SHORT
2026-01-09 14:08:11,756 - INFO -   Risk amount: $300.00
2026-01-09 14:08:11,756 - INFO -   Position size: 145397 units (1.454 lots)
2026-01-09 14:08:11,756 - INFO -   Actual risk: $300.00
2026-01-09 14:08:11,756 - INFO -   Stop distance: 0.00206 (20.6 pips)
2026-01-09 14:08:11,756 - INFO - OPENED SHORT | Price: 1.17392 | SL: 1.17608 | TP: 1.17176 | Size: 145,397 | Market: BEAR
2026-01-09 14:08:11,756 - INFO - OPENED SHORT | Price: 1.17392 | SL: 1.17608 | TP: 1.17176 | Size: 145,397 | Market: BEAR
2026-01-09 14:08:12,081 - INFO - 🔄 Trend reversal: Closing SHORT position only (disable_opposite_trade prevents LONG in BEAR market)
2026-01-09 14:08:12,081 - INFO - CLOSED SHORT | P/L: $-66.88 | Reason: OPPOSITE_TRADE_DISABLED | Duration: 360m
2026-01-09 14:08:12,081 - INFO - CLOSED SHORT | P/L: $-66.88 | Reason: OPPOSITE_TRADE_DISABLED | Duration: 360m
2026-01-09 14:08:12,504 - INFO - Market-aware position sizing:
2026-01-09 14:08:12,505 - INFO -   Market trend: BEAR, Position: SHORT
2026-01-09 14:08:12,505 - INFO -   Risk amount: $300.00
2026-01-09 14:08:12,505 - INFO -   Position size: 382294 units (3.823 lots)
2026-01-09 14:08:12,505 - INFO -   Actual risk: $300.00
2026-01-09 14:08:12,505 - INFO -   Stop distance: 0.00078 (7.8 pips)
2026-01-09 14:08:12,505 - INFO - OPENED SHORT | Price: 1.17568 | SL: 1.17656 | TP: 1.17480 | Size: 382,294 | Market: BEAR
2026-01-09 14:08:12,505 - INFO - OPENED SHORT | Price: 1.17568 | SL: 1.17656 | TP: 1.17480 | Size: 382,294 | Market: BEAR
2026-01-09 14:08:12,610 - INFO - CLOSED SHORT | P/L: $338.23 | Reason: TAKE_PROFIT | Duration: 100m
2026-01-09 14:08:12,610 - INFO - CLOSED SHORT | P/L: $338.23 | Reason: TAKE_PROFIT | Duration: 100m
2026-01-09 14:08:13,083 - INFO - ⚠️  Skipping LONG trade: disable_opposite_trade enabled and market trend is BEAR
2026-01-09 14:08:13,189 - INFO - Market-aware position sizing:
2026-01-09 14:08:13,189 - INFO -   Market trend: BEAR, Position: SHORT
2026-01-09 14:08:13,189 - INFO -   Risk amount: $300.00
2026-01-09 14:08:13,189 - INFO -   Position size: 153179 units (1.532 lots)
2026-01-09 14:08:13,189 - INFO -   Actual risk: $300.00
2026-01-09 14:08:13,189 - INFO -   Stop distance: 0.00196 (19.6 pips)
2026-01-09 14:08:13,189 - INFO - OPENED SHORT | Price: 1.17316 | SL: 1.17522 | TP: 1.17110 | Size: 153,179 | Market: BEAR
2026-01-09 14:08:13,189 - INFO - OPENED SHORT | Price: 1.17316 | SL: 1.17522 | TP: 1.17110 | Size: 153,179 | Market: BEAR
2026-01-09 14:08:13,507 - INFO - CLOSED SHORT | P/L: $315.32 | Reason: TAKE_PROFIT | Duration: 3220m
2026-01-09 14:08:13,507 - INFO - CLOSED SHORT | P/L: $315.32 | Reason: TAKE_PROFIT | Duration: 3220m
2026-01-09 14:08:13,828 - INFO - ⚠️  Skipping LONG trade: disable_opposite_trade enabled and market trend is BEAR
2026-01-09 14:08:14,041 - INFO - Market-aware position sizing:
2026-01-09 14:08:14,041 - INFO -   Market trend: BEAR, Position: SHORT
2026-01-09 14:08:14,041 - INFO -   Risk amount: $300.00
2026-01-09 14:08:14,041 - INFO -   Position size: 155100 units (1.551 lots)
2026-01-09 14:08:14,041 - INFO -   Actual risk: $300.00
2026-01-09 14:08:14,041 - INFO -   Stop distance: 0.00193 (19.3 pips)
2026-01-09 14:08:14,041 - INFO - OPENED SHORT | Price: 1.16757 | SL: 1.16960 | TP: 1.16554 | Size: 155,100 | Market: BEAR
2026-01-09 14:08:14,041 - INFO - OPENED SHORT | Price: 1.16757 | SL: 1.16960 | TP: 1.16554 | Size: 155,100 | Market: BEAR
2026-01-09 14:08:14,356 - INFO - 🔄 Trend reversal: Closing SHORT position only (disable_opposite_trade prevents LONG in BEAR market)
2026-01-09 14:08:14,357 - INFO - CLOSED SHORT | P/L: $-283.83 | Reason: OPPOSITE_TRADE_DISABLED | Duration: 320m
2026-01-09 14:08:14,357 - INFO - CLOSED SHORT | P/L: $-283.83 | Reason: OPPOSITE_TRADE_DISABLED | Duration: 320m
2026-01-09 14:08:14,675 - INFO - Market-aware position sizing:
2026-01-09 14:08:14,675 - INFO -   Market trend: BEAR, Position: SHORT
2026-01-09 14:08:14,675 - INFO -   Risk amount: $300.00
2026-01-09 14:08:14,675 - INFO -   Position size: 329565 units (3.296 lots)
2026-01-09 14:08:14,675 - INFO -   Actual risk: $300.00
2026-01-09 14:08:14,675 - INFO -   Stop distance: 0.00091 (9.1 pips)
2026-01-09 14:08:14,675 - INFO - OPENED SHORT | Price: 1.17206 | SL: 1.17307 | TP: 1.17105 | Size: 329,565 | Market: BEAR
2026-01-09 14:08:14,675 - INFO - OPENED SHORT | Price: 1.17206 | SL: 1.17307 | TP: 1.17105 | Size: 329,565 | Market: BEAR
2026-01-09 14:08:14,886 - INFO - 🔄 Trend reversal: Closing SHORT position only (disable_opposite_trade prevents LONG in BEAR market)
2026-01-09 14:08:14,886 - INFO - CLOSED SHORT | P/L: $6.59 | Reason: OPPOSITE_TRADE_DISABLED | Duration: 240m
2026-01-09 14:08:14,886 - INFO - CLOSED SHORT | P/L: $6.59 | Reason: OPPOSITE_TRADE_DISABLED | Duration: 240m
2026-01-09 14:08:15,097 - INFO - Market-aware position sizing:
2026-01-09 14:08:15,097 - INFO -   Market trend: BEAR, Position: SHORT
2026-01-09 14:08:15,097 - INFO -   Risk amount: $300.00
2026-01-09 14:08:15,097 - INFO -   Position size: 390822 units (3.908 lots)
2026-01-09 14:08:15,097 - INFO -   Actual risk: $300.00
2026-01-09 14:08:15,097 - INFO -   Stop distance: 0.00077 (7.7 pips)
2026-01-09 14:08:15,097 - INFO - OPENED SHORT | Price: 1.17300 | SL: 1.17387 | TP: 1.17213 | Size: 390,822 | Market: BEAR
2026-01-09 14:08:15,097 - INFO - OPENED SHORT | Price: 1.17300 | SL: 1.17387 | TP: 1.17213 | Size: 390,822 | Market: BEAR
2026-01-09 14:08:15,199 - INFO - CLOSED SHORT | P/L: $-339.08 | Reason: STOP_LOSS | Duration: 70m
2026-01-09 14:08:15,199 - INFO - CLOSED SHORT | P/L: $-339.08 | Reason: STOP_LOSS | Duration: 70m
2026-01-09 14:08:15,199 - INFO - ⚠️  Skipping LONG trade: disable_opposite_trade enabled and market trend is BEAR
2026-01-09 14:08:15,203 - INFO - Market-aware position sizing:
2026-01-09 14:08:15,203 - INFO -   Market trend: BEAR, Position: SHORT
2026-01-09 14:08:15,203 - INFO -   Risk amount: $300.00
2026-01-09 14:08:15,203 - INFO -   Position size: 200250 units (2.002 lots)
2026-01-09 14:08:15,203 - INFO -   Actual risk: $300.00
2026-01-09 14:08:15,203 - INFO -   Stop distance: 0.00150 (15.0 pips)
2026-01-09 14:08:15,203 - INFO - OPENED SHORT | Price: 1.17291 | SL: 1.17451 | TP: 1.17131 | Size: 200,250 | Market: BEAR
2026-01-09 14:08:15,203 - INFO - OPENED SHORT | Price: 1.17291 | SL: 1.17451 | TP: 1.17131 | Size: 200,250 | Market: BEAR
2026-01-09 14:08:15,306 - INFO - CLOSED SHORT | P/L: $320.03 | Reason: TAKE_PROFIT | Duration: 85m
2026-01-09 14:08:15,306 - INFO - CLOSED SHORT | P/L: $320.03 | Reason: TAKE_PROFIT | Duration: 85m
2026-01-09 14:08:15,359 - INFO - Progress: 80.0% (4000/4999)
2026-01-09 14:08:15,359 - INFO - Progress: 80.0% (4000/4999)
2026-01-09 14:08:15,576 - INFO - ⚠️  Skipping LONG trade: disable_opposite_trade enabled and market trend is BEAR
2026-01-09 14:08:15,630 - INFO - Market-aware position sizing:
2026-01-09 14:08:15,630 - INFO -   Market trend: BEAR, Position: SHORT
2026-01-09 14:08:15,630 - INFO -   Risk amount: $300.00
2026-01-09 14:08:15,630 - INFO -   Position size: 115212 units (1.152 lots)
2026-01-09 14:08:15,630 - INFO -   Actual risk: $300.00
2026-01-09 14:08:15,630 - INFO -   Stop distance: 0.00260 (26.0 pips)
2026-01-09 14:08:15,630 - INFO - OPENED SHORT | Price: 1.16958 | SL: 1.17228 | TP: 1.16688 | Size: 115,212 | Market: BEAR
2026-01-09 14:08:15,630 - INFO - OPENED SHORT | Price: 1.16958 | SL: 1.17228 | TP: 1.16688 | Size: 115,212 | Market: BEAR
2026-01-09 14:08:15,789 - INFO - 🔄 Trend reversal: Closing SHORT position only (disable_opposite_trade prevents LONG in BEAR market)
2026-01-09 14:08:15,789 - INFO - CLOSED SHORT | P/L: $-62.21 | Reason: OPPOSITE_TRADE_DISABLED | Duration: 170m
2026-01-09 14:08:15,789 - INFO - CLOSED SHORT | P/L: $-62.21 | Reason: OPPOSITE_TRADE_DISABLED | Duration: 170m
2026-01-09 14:08:15,792 - INFO - Market-aware position sizing:
2026-01-09 14:08:15,792 - INFO -   Market trend: BEAR, Position: SHORT
2026-01-09 14:08:15,792 - INFO -   Risk amount: $300.00
2026-01-09 14:08:15,792 - INFO -   Position size: 185173 units (1.852 lots)
2026-01-09 14:08:15,792 - INFO -   Actual risk: $300.00
2026-01-09 14:08:15,792 - INFO -   Stop distance: 0.00162 (16.2 pips)
2026-01-09 14:08:15,792 - INFO - OPENED SHORT | Price: 1.16874 | SL: 1.17046 | TP: 1.16702 | Size: 185,173 | Market: BEAR
2026-01-09 14:08:15,792 - INFO - OPENED SHORT | Price: 1.16874 | SL: 1.17046 | TP: 1.16702 | Size: 185,173 | Market: BEAR
2026-01-09 14:08:16,107 - INFO - 🔄 Trend reversal: Closing SHORT position only (disable_opposite_trade prevents LONG in BEAR market)
2026-01-09 14:08:16,107 - INFO - CLOSED SHORT | P/L: $-68.51 | Reason: OPPOSITE_TRADE_DISABLED | Duration: 340m
2026-01-09 14:08:16,107 - INFO - CLOSED SHORT | P/L: $-68.51 | Reason: OPPOSITE_TRADE_DISABLED | Duration: 340m
2026-01-09 14:08:16,319 - INFO - Market-aware position sizing:
2026-01-09 14:08:16,319 - INFO -   Market trend: BEAR, Position: SHORT
2026-01-09 14:08:16,320 - INFO -   Risk amount: $300.00
2026-01-09 14:08:16,320 - INFO -   Position size: 298361 units (2.984 lots)
2026-01-09 14:08:16,320 - INFO -   Actual risk: $300.00
2026-01-09 14:08:16,320 - INFO -   Stop distance: 0.00101 (10.1 pips)
2026-01-09 14:08:16,320 - INFO - OPENED SHORT | Price: 1.16934 | SL: 1.17045 | TP: 1.16823 | Size: 298,361 | Market: BEAR
2026-01-09 14:08:16,320 - INFO - OPENED SHORT | Price: 1.16934 | SL: 1.17045 | TP: 1.16823 | Size: 298,361 | Market: BEAR
2026-01-09 14:08:16,426 - INFO - 🔄 Trend reversal: Closing SHORT position only (disable_opposite_trade prevents LONG in BEAR market)
2026-01-09 14:08:16,426 - INFO - CLOSED SHORT | P/L: $-167.08 | Reason: OPPOSITE_TRADE_DISABLED | Duration: 120m
2026-01-09 14:08:16,426 - INFO - CLOSED SHORT | P/L: $-167.08 | Reason: OPPOSITE_TRADE_DISABLED | Duration: 120m
2026-01-09 14:08:16,478 - INFO - Market-aware position sizing:
2026-01-09 14:08:16,478 - INFO -   Market trend: BEAR, Position: SHORT
2026-01-09 14:08:16,478 - INFO -   Risk amount: $300.00
2026-01-09 14:08:16,478 - INFO -   Position size: 190081 units (1.901 lots)
2026-01-09 14:08:16,478 - INFO -   Actual risk: $300.00
2026-01-09 14:08:16,478 - INFO -   Stop distance: 0.00158 (15.8 pips)
2026-01-09 14:08:16,478 - INFO - OPENED SHORT | Price: 1.16864 | SL: 1.17032 | TP: 1.16696 | Size: 190,081 | Market: BEAR
2026-01-09 14:08:16,478 - INFO - OPENED SHORT | Price: 1.16864 | SL: 1.17032 | TP: 1.16696 | Size: 190,081 | Market: BEAR
2026-01-09 14:08:16,690 - INFO - 🔄 Trend reversal: Closing SHORT position only (disable_opposite_trade prevents LONG in BEAR market)
2026-01-09 14:08:16,690 - INFO - CLOSED SHORT | P/L: $-114.05 | Reason: OPPOSITE_TRADE_DISABLED | Duration: 225m
2026-01-09 14:08:16,690 - INFO - CLOSED SHORT | P/L: $-114.05 | Reason: OPPOSITE_TRADE_DISABLED | Duration: 225m
2026-01-09 14:08:17,064 - INFO - Market-aware position sizing:
2026-01-09 14:08:17,064 - INFO -   Market trend: BEAR, Position: SHORT
2026-01-09 14:08:17,064 - INFO -   Risk amount: $300.00
2026-01-09 14:08:17,064 - INFO -   Position size: 252405 units (2.524 lots)
2026-01-09 14:08:17,064 - INFO -   Actual risk: $300.00
2026-01-09 14:08:17,064 - INFO -   Stop distance: 0.00119 (11.9 pips)
2026-01-09 14:08:17,064 - INFO - OPENED SHORT | Price: 1.16830 | SL: 1.16959 | TP: 1.16701 | Size: 252,405 | Market: BEAR
2026-01-09 14:08:17,064 - INFO - OPENED SHORT | Price: 1.16830 | SL: 1.16959 | TP: 1.16701 | Size: 252,405 | Market: BEAR
2026-01-09 14:08:17,489 - INFO - 🔄 Trend reversal: Closing SHORT position only (disable_opposite_trade prevents LONG in BEAR market)
2026-01-09 14:08:17,489 - INFO - CLOSED SHORT | P/L: $80.77 | Reason: OPPOSITE_TRADE_DISABLED | Duration: 465m
2026-01-09 14:08:17,489 - INFO - CLOSED SHORT | P/L: $80.77 | Reason: OPPOSITE_TRADE_DISABLED | Duration: 465m
2026-01-09 14:08:17,806 - INFO - Market-aware position sizing:
2026-01-09 14:08:17,806 - INFO -   Market trend: BEAR, Position: SHORT
2026-01-09 14:08:17,806 - INFO -   Risk amount: $300.00
2026-01-09 14:08:17,806 - INFO -   Position size: 300791 units (3.008 lots)
2026-01-09 14:08:17,806 - INFO -   Actual risk: $300.00
2026-01-09 14:08:17,806 - INFO -   Stop distance: 0.00100 (10.0 pips)
2026-01-09 14:08:17,806 - INFO - OPENED SHORT | Price: 1.16739 | SL: 1.16849 | TP: 1.16629 | Size: 300,791 | Market: BEAR
2026-01-09 14:08:17,806 - INFO - OPENED SHORT | Price: 1.16739 | SL: 1.16849 | TP: 1.16629 | Size: 300,791 | Market: BEAR
2026-01-09 14:08:18,071 - INFO - CLOSED SHORT | P/L: $330.08 | Reason: TAKE_PROFIT | Duration: 330m
2026-01-09 14:08:18,071 - INFO - CLOSED SHORT | P/L: $330.08 | Reason: TAKE_PROFIT | Duration: 330m
2026-01-09 14:08:18,439 - INFO - ⚠️  Skipping LONG trade: disable_opposite_trade enabled and market trend is BEAR
2026-01-09 14:08:18,649 - INFO - Market-aware position sizing:
2026-01-09 14:08:18,649 - INFO -   Market trend: BEAR, Position: SHORT
2026-01-09 14:08:18,649 - INFO -   Risk amount: $300.00
2026-01-09 14:08:18,649 - INFO -   Position size: 508843 units (5.088 lots)
2026-01-09 14:08:18,649 - INFO -   Actual risk: $300.00
2026-01-09 14:08:18,649 - INFO -   Stop distance: 0.00059 (5.9 pips)
2026-01-09 14:08:18,649 - INFO - OPENED SHORT | Price: 1.16550 | SL: 1.16619 | TP: 1.16481 | Size: 508,843 | Market: BEAR
2026-01-09 14:08:18,649 - INFO - OPENED SHORT | Price: 1.16550 | SL: 1.16619 | TP: 1.16481 | Size: 508,843 | Market: BEAR
2026-01-09 14:08:18,755 - INFO - CLOSED SHORT | P/L: $350.88 | Reason: TAKE_PROFIT | Duration: 115m
2026-01-09 14:08:18,755 - INFO - CLOSED SHORT | P/L: $350.88 | Reason: TAKE_PROFIT | Duration: 115m
2026-01-09 14:08:18,809 - INFO - ⚠️  Skipping LONG trade: disable_opposite_trade enabled and market trend is BEAR
2026-01-09 14:08:18,925 - INFO - Market-aware position sizing:
2026-01-09 14:08:18,925 - INFO -   Market trend: BEAR, Position: SHORT
2026-01-09 14:08:18,925 - INFO -   Risk amount: $300.00
2026-01-09 14:08:18,925 - INFO -   Position size: 428414 units (4.284 lots)
2026-01-09 14:08:18,925 - INFO -   Actual risk: $300.00
2026-01-09 14:08:18,925 - INFO -   Stop distance: 0.00070 (7.0 pips)
2026-01-09 14:08:18,925 - INFO - OPENED SHORT | Price: 1.16508 | SL: 1.16588 | TP: 1.16428 | Size: 428,414 | Market: BEAR
2026-01-09 14:08:18,925 - INFO - OPENED SHORT | Price: 1.16508 | SL: 1.16588 | TP: 1.16428 | Size: 428,414 | Market: BEAR
2026-01-09 14:08:19,031 - INFO - CLOSED SHORT | P/L: $342.84 | Reason: TAKE_PROFIT | Duration: 115m
2026-01-09 14:08:19,031 - INFO - CLOSED SHORT | P/L: $342.84 | Reason: TAKE_PROFIT | Duration: 115m
2026-01-09 14:08:19,348 - INFO - ⚠️  Skipping LONG trade: disable_opposite_trade enabled and market trend is BEAR
2026-01-09 14:08:19,401 - INFO - Market-aware position sizing:
2026-01-09 14:08:19,401 - INFO -   Market trend: BEAR, Position: SHORT
2026-01-09 14:08:19,401 - INFO -   Risk amount: $300.00
2026-01-09 14:08:19,401 - INFO -   Position size: 109592 units (1.096 lots)
2026-01-09 14:08:19,401 - INFO -   Actual risk: $300.00
2026-01-09 14:08:19,401 - INFO -   Stop distance: 0.00274 (27.4 pips)
2026-01-09 14:08:19,401 - INFO - OPENED SHORT | Price: 1.16382 | SL: 1.16666 | TP: 1.16098 | Size: 109,592 | Market: BEAR
2026-01-09 14:08:19,401 - INFO - OPENED SHORT | Price: 1.16382 | SL: 1.16666 | TP: 1.16098 | Size: 109,592 | Market: BEAR
2026-01-09 14:08:19,614 - INFO - 🔄 Trend reversal: Closing SHORT position only (disable_opposite_trade prevents LONG in BEAR market)
2026-01-09 14:08:19,614 - INFO - CLOSED SHORT | P/L: $0.00 | Reason: OPPOSITE_TRADE_DISABLED | Duration: 250m
2026-01-09 14:08:19,614 - INFO - CLOSED SHORT | P/L: $0.00 | Reason: OPPOSITE_TRADE_DISABLED | Duration: 250m
2026-01-09 14:08:19,774 - INFO - Market-aware position sizing:
2026-01-09 14:08:19,774 - INFO -   Market trend: BEAR, Position: SHORT
2026-01-09 14:08:19,774 - INFO -   Risk amount: $300.00
2026-01-09 14:08:19,774 - INFO -   Position size: 382849 units (3.828 lots)
2026-01-09 14:08:19,774 - INFO -   Actual risk: $300.00
2026-01-09 14:08:19,774 - INFO -   Stop distance: 0.00078 (7.8 pips)
2026-01-09 14:08:19,774 - INFO - OPENED SHORT | Price: 1.16312 | SL: 1.16400 | TP: 1.16224 | Size: 382,849 | Market: BEAR
2026-01-09 14:08:19,774 - INFO - OPENED SHORT | Price: 1.16312 | SL: 1.16400 | TP: 1.16224 | Size: 382,849 | Market: BEAR
2026-01-09 14:08:19,775 - INFO - CLOSED SHORT | P/L: $0.00 | Reason: BACKTEST_END | Duration: 0m
2026-01-09 14:08:19,775 - INFO - CLOSED SHORT | P/L: $0.00 | Reason: BACKTEST_END | Duration: 0m
2026-01-09 14:08:19,775 - INFO - Backtest completed. Total trades: 44
2026-01-09 14:08:19,775 - INFO - Backtest completed. Total trades: 44
Downloading historical data...
Running backtest...

============================================================
BACKTEST RESULTS
============================================================
Instrument: EUR_USD
Period: 30 days
Total Trades: 44
Win Rate: 43.2%
Total Return: $479.44
Return %: 4.79%
Profit Factor: 1.10
Final Balance: $10479.44
/Users/dongchen/Documents/AI-project/GitHub/ppsupertrend/venv/lib/python3.9/site-packages/urllib3/__init__.py:35: NotOpenSSLWarning: urllib3 v2 only supports OpenSSL 1.1.1+, currently the 'ssl' module is compiled with 'LibreSSL 2.8.3'. See: https://github.com/urllib3/urllib3/issues/3020
  warnings.warn(
2026-01-09 14:08:20,392 - INFO - Downloading EUR_USD data for timeframes: ['M5', 'H3']
2026-01-09 14:08:20,392 - INFO - 
--- Downloading M5 data ---
2026-01-09 14:08:20,392 - INFO - Loading cached data from backtest/data/EUR_USD_M5_20251210_20260109.csv
2026-01-09 14:08:20,409 - INFO - ✓ M5: 4999 candles
2026-01-09 14:08:20,409 - INFO - 
--- Downloading H3 data ---
2026-01-09 14:08:20,409 - INFO - Loading cached data from backtest/data/EUR_USD_H3_20251210_20260109.csv
2026-01-09 14:08:20,411 - INFO - ✓ H3: 239 candles
2026-01-09 14:08:20,415 - INFO - Starting backtest for EUR_USD 5m
2026-01-09 14:08:20,415 - INFO - Trading data: 4999 candles
2026-01-09 14:08:20,415 - INFO - Market data: 239 candles
2026-01-09 14:08:20,415 - INFO - Backtest period: 2025-12-15 13:05:00+00:00 to 2026-01-09 21:35:00+00:00
2026-01-09 14:08:20,415 - INFO - Calculating indicators...
2026-01-09 14:08:23,371 - INFO - OPENED LONG | Price: 1.17490 | SL: 1.17369 | TP: 1.17611 | Size: 269,834 | Market: BULL
2026-01-09 14:08:23,631 - INFO - CLOSED LONG | P/L: $43.17 | Reason: OPPOSITE_TRADE_DISABLED | Duration: 300m
2026-01-09 14:08:23,784 - INFO - OPENED LONG | Price: 1.17586 | SL: 1.17467 | TP: 1.17705 | Size: 275,956 | Market: BULL
2026-01-09 14:08:23,940 - INFO - CLOSED LONG | P/L: $-289.75 | Reason: OPPOSITE_TRADE_DISABLED | Duration: 195m
2026-01-09 14:08:24,042 - INFO - OPENED LONG | Price: 1.17565 | SL: 1.17441 | TP: 1.17689 | Size: 262,750 | Market: BULL
2026-01-09 14:08:24,267 - INFO - CLOSED LONG | P/L: $326.27 | Reason: TAKE_PROFIT | Duration: 290m
2026-01-09 14:08:24,681 - INFO - OPENED LONG | Price: 1.17618 | SL: 1.17416 | TP: 1.17820 | Size: 156,077 | Market: BULL
2026-01-09 14:08:24,684 - INFO - CLOSED LONG | P/L: $-218.51 | Reason: OPPOSITE_TRADE_DISABLED | Duration: 50m
2026-01-09 14:08:25,415 - INFO - OPENED LONG | Price: 1.17252 | SL: 1.17066 | TP: 1.17438 | Size: 170,013 | Market: BULL
2026-01-09 14:08:25,466 - INFO - CLOSED LONG | P/L: $-251.62 | Reason: OPPOSITE_TRADE_DISABLED | Duration: 40m
2026-01-09 14:08:25,521 - INFO - OPENED LONG | Price: 1.17266 | SL: 1.17057 | TP: 1.17475 | Size: 150,506 | Market: BULL
2026-01-09 14:08:25,675 - INFO - CLOSED LONG | P/L: $315.05 | Reason: TAKE_PROFIT | Duration: 135m
2026-01-09 14:08:26,143 - INFO - OPENED LONG | Price: 1.17454 | SL: 1.17386 | TP: 1.17522 | Size: 514,469 | Market: BULL
2026-01-09 14:08:26,195 - INFO - CLOSED LONG | P/L: $-318.97 | Reason: OPPOSITE_TRADE_DISABLED | Duration: 50m
2026-01-09 14:08:26,402 - INFO - OPENED LONG | Price: 1.17442 | SL: 1.17360 | TP: 1.17524 | Size: 416,744 | Market: BULL
2026-01-09 14:08:26,508 - INFO - CLOSED LONG | P/L: $-341.67 | Reason: STOP_LOSS | Duration: 165m
2026-01-09 14:08:26,820 - INFO - OPENED LONG | Price: 1.17350 | SL: 1.17126 | TP: 1.17574 | Size: 139,911 | Market: BULL
2026-01-09 14:08:26,925 - INFO - CLOSED LONG | P/L: $-239.25 | Reason: OPPOSITE_TRADE_DISABLED | Duration: 135m
2026-01-09 14:08:27,183 - INFO - OPENED LONG | Price: 1.17276 | SL: 1.17162 | TP: 1.17390 | Size: 289,317 | Market: BULL
2026-01-09 14:08:27,289 - INFO - CLOSED LONG | P/L: $-211.20 | Reason: OPPOSITE_TRADE_DISABLED | Duration: 120m
2026-01-09 14:08:27,342 - INFO - OPENED LONG | Price: 1.17275 | SL: 1.17197 | TP: 1.17353 | Size: 439,895 | Market: BULL
2026-01-09 14:08:27,395 - INFO - Progress: 20.0% (1000/4999)
2026-01-09 14:08:27,450 - INFO - CLOSED LONG | P/L: $-268.34 | Reason: OPPOSITE_TRADE_DISABLED | Duration: 150m
2026-01-09 14:08:28,095 - INFO - OPENED LONG | Price: 1.17194 | SL: 1.16978 | TP: 1.17410 | Size: 145,656 | Market: BULL
2026-01-09 14:08:28,460 - INFO - CLOSED LONG | P/L: $-151.48 | Reason: OPPOSITE_TRADE_DISABLED | Duration: 415m
2026-01-09 14:08:28,562 - INFO - OPENED LONG | Price: 1.17196 | SL: 1.17061 | TP: 1.17331 | Size: 239,149 | Market: BULL
2026-01-09 14:08:28,618 - INFO - CLOSED LONG | P/L: $-282.20 | Reason: OPPOSITE_TRADE_DISABLED | Duration: 110m
2026-01-09 14:08:28,724 - INFO - OPENED LONG | Price: 1.17182 | SL: 1.17083 | TP: 1.17281 | Size: 336,840 | Market: BULL
2026-01-09 14:08:28,987 - INFO - CLOSED LONG | P/L: $-60.63 | Reason: OPPOSITE_TRADE_DISABLED | Duration: 265m
2026-01-09 14:08:29,044 - INFO - OPENED LONG | Price: 1.17233 | SL: 1.17113 | TP: 1.17353 | Size: 271,587 | Market: BULL
2026-01-09 14:08:29,099 - INFO - CLOSED LONG | P/L: $327.16 | Reason: TAKE_PROFIT | Duration: 80m
2026-01-09 14:08:29,780 - INFO - OPENED LONG | Price: 1.17588 | SL: 1.17495 | TP: 1.17681 | Size: 362,246 | Market: BULL
2026-01-09 14:08:29,938 - INFO - CLOSED LONG | P/L: $336.22 | Reason: TAKE_PROFIT | Duration: 200m
2026-01-09 14:08:30,352 - INFO - OPENED LONG | Price: 1.17812 | SL: 1.17669 | TP: 1.17955 | Size: 226,392 | Market: BULL
2026-01-09 14:08:30,456 - INFO - CLOSED LONG | P/L: $322.64 | Reason: TAKE_PROFIT | Duration: 120m
2026-01-09 14:08:30,877 - INFO - OPENED LONG | Price: 1.17794 | SL: 1.17669 | TP: 1.17919 | Size: 261,328 | Market: BULL
2026-01-09 14:08:30,980 - INFO - CLOSED LONG | P/L: $326.13 | Reason: TAKE_PROFIT | Duration: 90m
2026-01-09 14:08:31,464 - INFO - OPENED LONG | Price: 1.17988 | SL: 1.17864 | TP: 1.18112 | Size: 262,457 | Market: BULL
2026-01-09 14:08:31,572 - INFO - CLOSED LONG | P/L: $-236.21 | Reason: OPPOSITE_TRADE_DISABLED | Duration: 110m
2026-01-09 14:08:31,782 - INFO - Progress: 40.0% (2000/4999)
2026-01-09 14:08:32,198 - INFO - OPENED LONG | Price: 1.17810 | SL: 1.17765 | TP: 1.17855 | Size: 845,891 | Market: BULL
2026-01-09 14:08:32,301 - INFO - CLOSED LONG | P/L: $-236.85 | Reason: OPPOSITE_TRADE_DISABLED | Duration: 100m
2026-01-09 14:08:32,355 - INFO - OPENED LONG | Price: 1.17844 | SL: 1.17732 | TP: 1.17956 | Size: 294,642 | Market: BULL
2026-01-09 14:08:32,617 - INFO - CLOSED LONG | P/L: $20.62 | Reason: OPPOSITE_TRADE_DISABLED | Duration: 325m
2026-01-09 14:08:32,985 - INFO - OPENED LONG | Price: 1.17779 | SL: 1.17636 | TP: 1.17922 | Size: 226,136 | Market: BULL
2026-01-09 14:08:33,140 - INFO - CLOSED LONG | P/L: $322.61 | Reason: TAKE_PROFIT | Duration: 165m
2026-01-09 14:08:33,455 - INFO - OPENED LONG | Price: 1.17752 | SL: 1.17634 | TP: 1.17870 | Size: 277,889 | Market: BULL
2026-01-09 14:08:33,560 - INFO - CLOSED LONG | P/L: $-161.18 | Reason: OPPOSITE_TRADE_DISABLED | Duration: 115m
2026-01-09 14:08:33,664 - INFO - OPENED LONG | Price: 1.17776 | SL: 1.17643 | TP: 1.17909 | Size: 244,720 | Market: BULL
2026-01-09 14:08:33,823 - INFO - CLOSED LONG | P/L: $-44.05 | Reason: OPPOSITE_TRADE_DISABLED | Duration: 220m
2026-01-09 14:08:34,032 - INFO - OPENED LONG | Price: 1.17696 | SL: 1.17535 | TP: 1.17857 | Size: 198,663 | Market: BULL
2026-01-09 14:08:34,136 - INFO - CLOSED LONG | P/L: $319.87 | Reason: TAKE_PROFIT | Duration: 115m
2026-01-09 14:08:34,451 - INFO - OPENED LONG | Price: 1.17740 | SL: 1.17559 | TP: 1.17921 | Size: 175,145 | Market: BULL
2026-01-09 14:08:34,572 - INFO - CLOSED LONG | P/L: $-178.65 | Reason: OPPOSITE_TRADE_DISABLED | Duration: 105m
2026-01-09 14:08:34,731 - INFO - OPENED LONG | Price: 1.17628 | SL: 1.17508 | TP: 1.17748 | Size: 271,540 | Market: BULL
2026-01-09 14:08:35,046 - INFO - CLOSED LONG | P/L: $327.15 | Reason: TAKE_PROFIT | Duration: 385m
2026-01-09 14:08:36,146 - INFO - Progress: 60.0% (3000/4999)
2026-01-09 14:08:36,985 - INFO - OPENED SHORT | Price: 1.17392 | SL: 1.17608 | TP: 1.17176 | Size: 145,397 | Market: BEAR
2026-01-09 14:08:37,301 - INFO - CLOSED SHORT | P/L: $-66.88 | Reason: OPPOSITE_TRADE_DISABLED | Duration: 360m
2026-01-09 14:08:37,724 - INFO - OPENED SHORT | Price: 1.17568 | SL: 1.17656 | TP: 1.17480 | Size: 382,294 | Market: BEAR
2026-01-09 14:08:37,828 - INFO - CLOSED SHORT | P/L: $338.23 | Reason: TAKE_PROFIT | Duration: 100m
2026-01-09 14:08:38,423 - INFO - OPENED SHORT | Price: 1.17316 | SL: 1.17522 | TP: 1.17110 | Size: 153,179 | Market: BEAR
2026-01-09 14:08:38,738 - INFO - CLOSED SHORT | P/L: $315.32 | Reason: TAKE_PROFIT | Duration: 3220m
2026-01-09 14:08:39,267 - INFO - OPENED SHORT | Price: 1.16757 | SL: 1.16960 | TP: 1.16554 | Size: 155,100 | Market: BEAR
2026-01-09 14:08:39,580 - INFO - CLOSED SHORT | P/L: $-283.83 | Reason: OPPOSITE_TRADE_DISABLED | Duration: 320m
2026-01-09 14:08:39,898 - INFO - OPENED SHORT | Price: 1.17206 | SL: 1.17307 | TP: 1.17105 | Size: 329,565 | Market: BEAR
2026-01-09 14:08:40,117 - INFO - CLOSED SHORT | P/L: $6.59 | Reason: OPPOSITE_TRADE_DISABLED | Duration: 240m
2026-01-09 14:08:40,329 - INFO - OPENED SHORT | Price: 1.17300 | SL: 1.17387 | TP: 1.17213 | Size: 390,822 | Market: BEAR
2026-01-09 14:08:40,433 - INFO - CLOSED SHORT | P/L: $-339.08 | Reason: STOP_LOSS | Duration: 70m
2026-01-09 14:08:40,436 - INFO - OPENED SHORT | Price: 1.17291 | SL: 1.17451 | TP: 1.17131 | Size: 200,250 | Market: BEAR
2026-01-09 14:08:40,541 - INFO - CLOSED SHORT | P/L: $320.03 | Reason: TAKE_PROFIT | Duration: 85m
2026-01-09 14:08:40,594 - INFO - Progress: 80.0% (4000/4999)
2026-01-09 14:08:40,857 - INFO - OPENED SHORT | Price: 1.16958 | SL: 1.17228 | TP: 1.16688 | Size: 115,212 | Market: BEAR
2026-01-09 14:08:41,015 - INFO - CLOSED SHORT | P/L: $-62.21 | Reason: OPPOSITE_TRADE_DISABLED | Duration: 170m
2026-01-09 14:08:41,018 - INFO - OPENED SHORT | Price: 1.16874 | SL: 1.17046 | TP: 1.16702 | Size: 185,173 | Market: BEAR
2026-01-09 14:08:41,333 - INFO - CLOSED SHORT | P/L: $-68.51 | Reason: OPPOSITE_TRADE_DISABLED | Duration: 340m
2026-01-09 14:08:41,543 - INFO - OPENED SHORT | Price: 1.16934 | SL: 1.17045 | TP: 1.16823 | Size: 298,361 | Market: BEAR
2026-01-09 14:08:41,649 - INFO - CLOSED SHORT | P/L: $-167.08 | Reason: OPPOSITE_TRADE_DISABLED | Duration: 120m
2026-01-09 14:08:41,715 - INFO - OPENED SHORT | Price: 1.16864 | SL: 1.17032 | TP: 1.16696 | Size: 190,081 | Market: BEAR
2026-01-09 14:08:41,924 - INFO - CLOSED SHORT | P/L: $-114.05 | Reason: OPPOSITE_TRADE_DISABLED | Duration: 225m
2026-01-09 14:08:42,295 - INFO - OPENED SHORT | Price: 1.16830 | SL: 1.16959 | TP: 1.16701 | Size: 252,405 | Market: BEAR
2026-01-09 14:08:42,716 - INFO - CLOSED SHORT | P/L: $80.77 | Reason: OPPOSITE_TRADE_DISABLED | Duration: 465m
2026-01-09 14:08:43,031 - INFO - OPENED SHORT | Price: 1.16739 | SL: 1.16849 | TP: 1.16629 | Size: 300,791 | Market: BEAR
2026-01-09 14:08:43,299 - INFO - CLOSED SHORT | P/L: $330.08 | Reason: TAKE_PROFIT | Duration: 330m
2026-01-09 14:08:43,883 - INFO - OPENED SHORT | Price: 1.16550 | SL: 1.16619 | TP: 1.16481 | Size: 508,843 | Market: BEAR
2026-01-09 14:08:43,990 - INFO - CLOSED SHORT | P/L: $350.88 | Reason: TAKE_PROFIT | Duration: 115m
2026-01-09 14:08:44,155 - INFO - OPENED SHORT | Price: 1.16508 | SL: 1.16588 | TP: 1.16428 | Size: 428,414 | Market: BEAR
2026-01-09 14:08:44,264 - INFO - CLOSED SHORT | P/L: $342.84 | Reason: TAKE_PROFIT | Duration: 115m
2026-01-09 14:08:44,637 - INFO - OPENED SHORT | Price: 1.16382 | SL: 1.16666 | TP: 1.16098 | Size: 109,592 | Market: BEAR
2026-01-09 14:08:44,854 - INFO - CLOSED SHORT | P/L: $0.00 | Reason: OPPOSITE_TRADE_DISABLED | Duration: 250m
2026-01-09 14:08:45,018 - INFO - OPENED SHORT | Price: 1.16312 | SL: 1.16400 | TP: 1.16224 | Size: 382,849 | Market: BEAR
2026-01-09 14:08:45,018 - INFO - CLOSED SHORT | P/L: $0.00 | Reason: BACKTEST_END | Duration: 0m
2026-01-09 14:08:45,018 - INFO - Backtest completed. Total trades: 44
/Users/dongchen/Documents/AI-project/GitHub/ppsupertrend/./backtest/src/report_generator.py:535: UserWarning: Converting to PeriodArray/Index representation will drop timezone information.
  monthly_df['month'] = monthly_df['exit_time'].dt.to_period('M')
Starting comprehensive backtest...
Instrument: EUR_USD
Timeframe: 5m
Period: 30 days

=== Downloading Data ===
Downloaded 4999 M5 candles
Downloaded 239 H3 candles

=== Running Backtest ===
Backtest completed: 44 trades
Final balance: $10,479.44
Total return: 4.79%

=== Generating Reports ===
Generating comprehensive backtest reports with prefix 'bt_EUR_USD_5m_account1_30d_20260109_140753'...
✓ Generated 5 visualization plots
✓ Generated detailed CSV trades report
✓ Generated comprehensive text summary
✓ Generated machine-readable JSON report

Report generation completed. 8 files generated in backtest/results/
Files generated:
  - bt_EUR_USD_5m_account1_30d_20260109_140753_equity_curve.png
  - bt_EUR_USD_5m_account1_30d_20260109_140753_drawdown.png
  - bt_EUR_USD_5m_account1_30d_20260109_140753_pl_distribution.png
  - bt_EUR_USD_5m_account1_30d_20260109_140753_market_analysis.png
  - bt_EUR_USD_5m_account1_30d_20260109_140753_position_analysis.png
  - bt_EUR_USD_5m_account1_30d_20260109_140753_EUR_USD_5m_trades.csv
  - bt_EUR_USD_5m_account1_30d_20260109_140753_EUR_USD_5m_summary.txt
  - bt_EUR_USD_5m_account1_30d_20260109_140753_EUR_USD_5m_report.json

=== Backtest Summary ===
Instrument: EUR_USD (5m)
Period: 30 days
Total Trades: 44
Win Rate: 43.2%
Total Return: $479.44 (4.79%)
Profit Factor: 1.10
Max Drawdown: -20.29%

Reports saved to: backtest/results/
  - bt_EUR_USD_5m_account1_30d_20260109_140753_equity_curve.png
  - bt_EUR_USD_5m_account1_30d_20260109_140753_drawdown.png
  - bt_EUR_USD_5m_account1_30d_20260109_140753_pl_distribution.png
  - bt_EUR_USD_5m_account1_30d_20260109_140753_market_analysis.png
  - bt_EUR_USD_5m_account1_30d_20260109_140753_position_analysis.png
  - bt_EUR_USD_5m_account1_30d_20260109_140753_EUR_USD_5m_trades.csv
  - bt_EUR_USD_5m_account1_30d_20260109_140753_EUR_USD_5m_summary.txt
  - bt_EUR_USD_5m_account1_30d_20260109_140753_EUR_USD_5m_report.json

=== Backtest Complete ===
