/Users/dongchen/Documents/AI-project/GitHub/ppsupertrend/venv/lib/python3.9/site-packages/urllib3/__init__.py:35: NotOpenSSLWarning: urllib3 v2 only supports OpenSSL 1.1.1+, currently the 'ssl' module is compiled with 'LibreSSL 2.8.3'. See: https://github.com/urllib3/urllib3/issues/3020
  warnings.warn(
2026-01-09 13:43:16,582 - INFO - Downloading EUR_USD data for timeframes: ['M5', 'H3']
2026-01-09 13:43:16,582 - INFO - Downloading EUR_USD data for timeframes: ['M5', 'H3']
2026-01-09 13:43:16,582 - INFO - 
--- Downloading M5 data ---
2026-01-09 13:43:16,582 - INFO - 
--- Downloading M5 data ---
2026-01-09 13:43:16,582 - INFO - Downloading recent EUR_USD M5 data...
2026-01-09 13:43:16,582 - INFO - Downloading recent EUR_USD M5 data...
2026-01-09 13:43:16,582 - INFO - Requesting 5000 recent candles
2026-01-09 13:43:16,582 - INFO - Requesting 5000 recent candles
2026-01-09 13:43:17,974 - INFO - Downloaded 4999 candles from 2025-12-15 13:05:00+00:00 to 2026-01-09 21:35:00+00:00
2026-01-09 13:43:17,974 - INFO - Downloaded 4999 candles from 2025-12-15 13:05:00+00:00 to 2026-01-09 21:35:00+00:00
2026-01-09 13:43:17,996 - INFO - Data cached to backtest/data/EUR_USD_M5_20251210_20260109.csv
2026-01-09 13:43:17,996 - INFO - Data cached to backtest/data/EUR_USD_M5_20251210_20260109.csv
2026-01-09 13:43:17,996 - INFO - ✓ M5: 4999 candles
2026-01-09 13:43:17,996 - INFO - ✓ M5: 4999 candles
2026-01-09 13:43:17,996 - INFO - 
--- Downloading H3 data ---
2026-01-09 13:43:17,996 - INFO - 
--- Downloading H3 data ---
2026-01-09 13:43:17,997 - INFO - Downloading recent EUR_USD H3 data...
2026-01-09 13:43:17,997 - INFO - Downloading recent EUR_USD H3 data...
2026-01-09 13:43:17,997 - INFO - Requesting 240 recent candles
2026-01-09 13:43:17,997 - INFO - Requesting 240 recent candles
2026-01-09 13:43:18,226 - INFO - Downloaded 239 candles from 2025-11-26 22:00:00+00:00 to 2026-01-09 16:00:00+00:00
2026-01-09 13:43:18,226 - INFO - Downloaded 239 candles from 2025-11-26 22:00:00+00:00 to 2026-01-09 16:00:00+00:00
2026-01-09 13:43:18,228 - INFO - Data cached to backtest/data/EUR_USD_H3_20251210_20260109.csv
2026-01-09 13:43:18,228 - INFO - Data cached to backtest/data/EUR_USD_H3_20251210_20260109.csv
2026-01-09 13:43:18,228 - INFO - ✓ H3: 239 candles
2026-01-09 13:43:18,228 - INFO - ✓ H3: 239 candles

==================================================
DOWNLOAD SUMMARY
==================================================
M5: 4999 candles (2025-12-15 13:05:00+00:00 to 2026-01-09 21:35:00+00:00)
H3: 239 candles (2025-11-26 22:00:00+00:00 to 2026-01-09 16:00:00+00:00)
/Users/dongchen/Documents/AI-project/GitHub/ppsupertrend/venv/lib/python3.9/site-packages/urllib3/__init__.py:35: NotOpenSSLWarning: urllib3 v2 only supports OpenSSL 1.1.1+, currently the 'ssl' module is compiled with 'LibreSSL 2.8.3'. See: https://github.com/urllib3/urllib3/issues/3020
  warnings.warn(
2026-01-09 13:43:18,488 - INFO - Downloading EUR_USD data for timeframes: ['M5', 'H3']
2026-01-09 13:43:18,488 - INFO - Downloading EUR_USD data for timeframes: ['M5', 'H3']
2026-01-09 13:43:18,488 - INFO - 
--- Downloading M5 data ---
2026-01-09 13:43:18,488 - INFO - 
--- Downloading M5 data ---
2026-01-09 13:43:18,488 - INFO - Loading cached data from backtest/data/EUR_USD_M5_20251210_20260109.csv
2026-01-09 13:43:18,488 - INFO - Loading cached data from backtest/data/EUR_USD_M5_20251210_20260109.csv
2026-01-09 13:43:18,503 - INFO - ✓ M5: 4999 candles
2026-01-09 13:43:18,503 - INFO - ✓ M5: 4999 candles
2026-01-09 13:43:18,504 - INFO - 
--- Downloading H3 data ---
2026-01-09 13:43:18,504 - INFO - 
--- Downloading H3 data ---
2026-01-09 13:43:18,504 - INFO - Loading cached data from backtest/data/EUR_USD_H3_20251210_20260109.csv
2026-01-09 13:43:18,504 - INFO - Loading cached data from backtest/data/EUR_USD_H3_20251210_20260109.csv
2026-01-09 13:43:18,505 - INFO - ✓ H3: 239 candles
2026-01-09 13:43:18,505 - INFO - ✓ H3: 239 candles
2026-01-09 13:43:18,509 - INFO - Starting backtest for EUR_USD 5m
2026-01-09 13:43:18,509 - INFO - Starting backtest for EUR_USD 5m
2026-01-09 13:43:18,509 - INFO - Trading data: 4999 candles
2026-01-09 13:43:18,509 - INFO - Trading data: 4999 candles
2026-01-09 13:43:18,509 - INFO - Market data: 239 candles
2026-01-09 13:43:18,509 - INFO - Market data: 239 candles
2026-01-09 13:43:18,509 - INFO - Backtest period: 2025-12-15 13:05:00+00:00 to 2026-01-09 21:35:00+00:00
2026-01-09 13:43:18,509 - INFO - Backtest period: 2025-12-15 13:05:00+00:00 to 2026-01-09 21:35:00+00:00
2026-01-09 13:43:18,509 - INFO - Calculating indicators...
2026-01-09 13:43:18,509 - INFO - Calculating indicators...
2026-01-09 13:43:21,324 - INFO - OPENED SHORT | Price: 1.17506 | SL: 1.17706 | TP: 1.17406 | Size: 39,931 | Market: BULL
2026-01-09 13:43:21,324 - INFO - OPENED SHORT | Price: 1.17506 | SL: 1.17706 | TP: 1.17406 | Size: 39,931 | Market: BULL
2026-01-09 13:43:21,379 - INFO - CLOSED SHORT | P/L: $40.00 | Reason: TAKE_PROFIT | Duration: 75m
2026-01-09 13:43:21,379 - INFO - CLOSED SHORT | P/L: $40.00 | Reason: TAKE_PROFIT | Duration: 75m
2026-01-09 13:43:21,435 - INFO - OPENED LONG | Price: 1.17490 | SL: 1.17369 | TP: 1.17611 | Size: 99,026 | Market: BULL
2026-01-09 13:43:21,435 - INFO - OPENED LONG | Price: 1.17490 | SL: 1.17369 | TP: 1.17611 | Size: 99,026 | Market: BULL
2026-01-09 13:43:21,710 - INFO - CLOSED LONG | P/L: $15.84 | Reason: SIGNAL_REVERSAL | Duration: 300m
2026-01-09 13:43:21,710 - INFO - CLOSED LONG | P/L: $15.84 | Reason: SIGNAL_REVERSAL | Duration: 300m
2026-01-09 13:43:21,711 - INFO - OPENED SHORT | Price: 1.17506 | SL: 1.17597 | TP: 1.17461 | Size: 88,284 | Market: BULL
2026-01-09 13:43:21,711 - INFO - OPENED SHORT | Price: 1.17506 | SL: 1.17597 | TP: 1.17461 | Size: 88,284 | Market: BULL
2026-01-09 13:43:21,870 - INFO - CLOSED SHORT | P/L: $-70.63 | Reason: SIGNAL_REVERSAL | Duration: 130m
2026-01-09 13:43:21,870 - INFO - CLOSED SHORT | P/L: $-70.63 | Reason: SIGNAL_REVERSAL | Duration: 130m
2026-01-09 13:43:21,870 - INFO - OPENED LONG | Price: 1.17586 | SL: 1.17467 | TP: 1.17705 | Size: 101,084 | Market: BULL
2026-01-09 13:43:21,870 - INFO - OPENED LONG | Price: 1.17586 | SL: 1.17467 | TP: 1.17705 | Size: 101,084 | Market: BULL
2026-01-09 13:43:22,034 - INFO - CLOSED LONG | P/L: $-106.14 | Reason: SIGNAL_REVERSAL | Duration: 195m
2026-01-09 13:43:22,034 - INFO - CLOSED LONG | P/L: $-106.14 | Reason: SIGNAL_REVERSAL | Duration: 195m
2026-01-09 13:43:22,034 - INFO - OPENED SHORT | Price: 1.17481 | SL: 1.17578 | TP: 1.17433 | Size: 82,580 | Market: BULL
2026-01-09 13:43:22,034 - INFO - OPENED SHORT | Price: 1.17481 | SL: 1.17578 | TP: 1.17433 | Size: 82,580 | Market: BULL
2026-01-09 13:43:22,140 - INFO - CLOSED SHORT | P/L: $-69.37 | Reason: SIGNAL_REVERSAL | Duration: 105m
2026-01-09 13:43:22,140 - INFO - CLOSED SHORT | P/L: $-69.37 | Reason: SIGNAL_REVERSAL | Duration: 105m
2026-01-09 13:43:22,140 - INFO - OPENED LONG | Price: 1.17565 | SL: 1.17441 | TP: 1.17689 | Size: 96,636 | Market: BULL
2026-01-09 13:43:22,140 - INFO - OPENED LONG | Price: 1.17565 | SL: 1.17441 | TP: 1.17689 | Size: 96,636 | Market: BULL
2026-01-09 13:43:22,356 - INFO - CLOSED LONG | P/L: $120.00 | Reason: TAKE_PROFIT | Duration: 290m
2026-01-09 13:43:22,356 - INFO - CLOSED LONG | P/L: $120.00 | Reason: TAKE_PROFIT | Duration: 290m
2026-01-09 13:43:22,571 - INFO - OPENED SHORT | Price: 1.17665 | SL: 1.18042 | TP: 1.17477 | Size: 21,243 | Market: BULL
2026-01-09 13:43:22,571 - INFO - OPENED SHORT | Price: 1.17665 | SL: 1.18042 | TP: 1.17477 | Size: 21,243 | Market: BULL
2026-01-09 13:43:22,682 - INFO - CLOSED SHORT | P/L: $40.00 | Reason: TAKE_PROFIT | Duration: 145m
2026-01-09 13:43:22,682 - INFO - CLOSED SHORT | P/L: $40.00 | Reason: TAKE_PROFIT | Duration: 145m
2026-01-09 13:43:22,795 - INFO - OPENED LONG | Price: 1.17618 | SL: 1.17416 | TP: 1.17820 | Size: 59,343 | Market: BULL
2026-01-09 13:43:22,795 - INFO - OPENED LONG | Price: 1.17618 | SL: 1.17416 | TP: 1.17820 | Size: 59,343 | Market: BULL
2026-01-09 13:43:22,798 - INFO - CLOSED LONG | P/L: $-83.08 | Reason: SIGNAL_REVERSAL | Duration: 50m
2026-01-09 13:43:22,798 - INFO - CLOSED LONG | P/L: $-83.08 | Reason: SIGNAL_REVERSAL | Duration: 50m
2026-01-09 13:43:22,798 - INFO - OPENED SHORT | Price: 1.17478 | SL: 1.17684 | TP: 1.17375 | Size: 38,856 | Market: BULL
2026-01-09 13:43:22,798 - INFO - OPENED SHORT | Price: 1.17478 | SL: 1.17684 | TP: 1.17375 | Size: 38,856 | Market: BULL
2026-01-09 13:43:23,221 - INFO - CLOSED SHORT | P/L: $40.00 | Reason: TAKE_PROFIT | Duration: 370m
2026-01-09 13:43:23,221 - INFO - CLOSED SHORT | P/L: $40.00 | Reason: TAKE_PROFIT | Duration: 370m
2026-01-09 13:43:23,595 - INFO - OPENED LONG | Price: 1.17252 | SL: 1.17066 | TP: 1.17438 | Size: 64,357 | Market: BULL
2026-01-09 13:43:23,595 - INFO - OPENED LONG | Price: 1.17252 | SL: 1.17066 | TP: 1.17438 | Size: 64,357 | Market: BULL
2026-01-09 13:43:23,647 - INFO - CLOSED LONG | P/L: $-95.25 | Reason: SIGNAL_REVERSAL | Duration: 40m
2026-01-09 13:43:23,647 - INFO - CLOSED LONG | P/L: $-95.25 | Reason: SIGNAL_REVERSAL | Duration: 40m
2026-01-09 13:43:23,647 - INFO - OPENED SHORT | Price: 1.17104 | SL: 1.17296 | TP: 1.17008 | Size: 41,664 | Market: BULL
2026-01-09 13:43:23,647 - INFO - OPENED SHORT | Price: 1.17104 | SL: 1.17296 | TP: 1.17008 | Size: 41,664 | Market: BULL
2026-01-09 13:43:23,702 - INFO - CLOSED SHORT | P/L: $-67.50 | Reason: SIGNAL_REVERSAL | Duration: 80m
2026-01-09 13:43:23,702 - INFO - CLOSED SHORT | P/L: $-67.50 | Reason: SIGNAL_REVERSAL | Duration: 80m
2026-01-09 13:43:23,703 - INFO - OPENED LONG | Price: 1.17266 | SL: 1.17057 | TP: 1.17475 | Size: 57,326 | Market: BULL
2026-01-09 13:43:23,703 - INFO - OPENED LONG | Price: 1.17266 | SL: 1.17057 | TP: 1.17475 | Size: 57,326 | Market: BULL
2026-01-09 13:43:23,861 - INFO - CLOSED LONG | P/L: $120.00 | Reason: TAKE_PROFIT | Duration: 135m
2026-01-09 13:43:23,861 - INFO - CLOSED LONG | P/L: $120.00 | Reason: TAKE_PROFIT | Duration: 135m
2026-01-09 13:43:24,023 - INFO - OPENED SHORT | Price: 1.17438 | SL: 1.17605 | TP: 1.17354 | Size: 47,801 | Market: BULL
2026-01-09 13:43:24,023 - INFO - OPENED SHORT | Price: 1.17438 | SL: 1.17605 | TP: 1.17354 | Size: 47,801 | Market: BULL
2026-01-09 13:43:24,343 - INFO - CLOSED SHORT | P/L: $-7.65 | Reason: SIGNAL_REVERSAL | Duration: 350m
2026-01-09 13:43:24,343 - INFO - CLOSED SHORT | P/L: $-7.65 | Reason: SIGNAL_REVERSAL | Duration: 350m
2026-01-09 13:43:24,344 - INFO - OPENED LONG | Price: 1.17454 | SL: 1.17386 | TP: 1.17522 | Size: 175,663 | Market: BULL
2026-01-09 13:43:24,344 - INFO - OPENED LONG | Price: 1.17454 | SL: 1.17386 | TP: 1.17522 | Size: 175,663 | Market: BULL
2026-01-09 13:43:24,398 - INFO - CLOSED LONG | P/L: $-108.91 | Reason: SIGNAL_REVERSAL | Duration: 50m
2026-01-09 13:43:24,398 - INFO - CLOSED LONG | P/L: $-108.91 | Reason: SIGNAL_REVERSAL | Duration: 50m
2026-01-09 13:43:24,398 - INFO - OPENED SHORT | Price: 1.17392 | SL: 1.17487 | TP: 1.17344 | Size: 84,158 | Market: BULL
2026-01-09 13:43:24,398 - INFO - OPENED SHORT | Price: 1.17392 | SL: 1.17487 | TP: 1.17344 | Size: 84,158 | Market: BULL
2026-01-09 13:43:24,613 - INFO - CLOSED SHORT | P/L: $-42.08 | Reason: SIGNAL_REVERSAL | Duration: 230m
2026-01-09 13:43:24,613 - INFO - CLOSED SHORT | P/L: $-42.08 | Reason: SIGNAL_REVERSAL | Duration: 230m
2026-01-09 13:43:24,613 - INFO - OPENED LONG | Price: 1.17442 | SL: 1.17360 | TP: 1.17524 | Size: 146,365 | Market: BULL
2026-01-09 13:43:24,613 - INFO - OPENED LONG | Price: 1.17442 | SL: 1.17360 | TP: 1.17524 | Size: 146,365 | Market: BULL
2026-01-09 13:43:24,723 - INFO - CLOSED LONG | P/L: $-120.00 | Reason: STOP_LOSS | Duration: 165m
2026-01-09 13:43:24,723 - INFO - CLOSED LONG | P/L: $-120.00 | Reason: STOP_LOSS | Duration: 165m
2026-01-09 13:43:24,724 - INFO - OPENED SHORT | Price: 1.17338 | SL: 1.17530 | TP: 1.17242 | Size: 41,630 | Market: BULL
2026-01-09 13:43:24,724 - INFO - OPENED SHORT | Price: 1.17338 | SL: 1.17530 | TP: 1.17242 | Size: 41,630 | Market: BULL
2026-01-09 13:43:24,828 - INFO - CLOSED SHORT | P/L: $40.00 | Reason: TAKE_PROFIT | Duration: 80m
2026-01-09 13:43:24,828 - INFO - CLOSED SHORT | P/L: $40.00 | Reason: TAKE_PROFIT | Duration: 80m
2026-01-09 13:43:25,045 - INFO - OPENED LONG | Price: 1.17350 | SL: 1.17126 | TP: 1.17574 | Size: 53,470 | Market: BULL
2026-01-09 13:43:25,045 - INFO - OPENED LONG | Price: 1.17350 | SL: 1.17126 | TP: 1.17574 | Size: 53,470 | Market: BULL
2026-01-09 13:43:25,163 - INFO - CLOSED LONG | P/L: $-91.43 | Reason: SIGNAL_REVERSAL | Duration: 135m
2026-01-09 13:43:25,163 - INFO - CLOSED LONG | P/L: $-91.43 | Reason: SIGNAL_REVERSAL | Duration: 135m
2026-01-09 13:43:25,163 - INFO - OPENED SHORT | Price: 1.17179 | SL: 1.17577 | TP: 1.16980 | Size: 20,078 | Market: BULL
2026-01-09 13:43:25,163 - INFO - OPENED SHORT | Price: 1.17179 | SL: 1.17577 | TP: 1.16980 | Size: 20,078 | Market: BULL
2026-01-09 13:43:25,429 - INFO - CLOSED SHORT | P/L: $-19.48 | Reason: SIGNAL_REVERSAL | Duration: 270m
2026-01-09 13:43:25,429 - INFO - CLOSED SHORT | P/L: $-19.48 | Reason: SIGNAL_REVERSAL | Duration: 270m
2026-01-09 13:43:25,429 - INFO - OPENED LONG | Price: 1.17276 | SL: 1.17162 | TP: 1.17390 | Size: 105,547 | Market: BULL
2026-01-09 13:43:25,429 - INFO - OPENED LONG | Price: 1.17276 | SL: 1.17162 | TP: 1.17390 | Size: 105,547 | Market: BULL
2026-01-09 13:43:25,537 - INFO - CLOSED LONG | P/L: $-77.05 | Reason: SIGNAL_REVERSAL | Duration: 120m
2026-01-09 13:43:25,537 - INFO - CLOSED LONG | P/L: $-77.05 | Reason: SIGNAL_REVERSAL | Duration: 120m
2026-01-09 13:43:25,537 - INFO - OPENED SHORT | Price: 1.17203 | SL: 1.17281 | TP: 1.17164 | Size: 102,231 | Market: BULL
2026-01-09 13:43:25,537 - INFO - OPENED SHORT | Price: 1.17203 | SL: 1.17281 | TP: 1.17164 | Size: 102,231 | Market: BULL
2026-01-09 13:43:25,592 - INFO - CLOSED SHORT | P/L: $-73.61 | Reason: SIGNAL_REVERSAL | Duration: 60m
2026-01-09 13:43:25,592 - INFO - CLOSED SHORT | P/L: $-73.61 | Reason: SIGNAL_REVERSAL | Duration: 60m
2026-01-09 13:43:25,592 - INFO - OPENED LONG | Price: 1.17275 | SL: 1.17197 | TP: 1.17353 | Size: 153,456 | Market: BULL
2026-01-09 13:43:25,592 - INFO - OPENED LONG | Price: 1.17275 | SL: 1.17197 | TP: 1.17353 | Size: 153,456 | Market: BULL
2026-01-09 13:43:25,648 - INFO - Progress: 20.0% (1000/4999)
2026-01-09 13:43:25,648 - INFO - Progress: 20.0% (1000/4999)
2026-01-09 13:43:25,703 - INFO - CLOSED LONG | P/L: $-93.61 | Reason: SIGNAL_REVERSAL | Duration: 150m
2026-01-09 13:43:25,703 - INFO - CLOSED LONG | P/L: $-93.61 | Reason: SIGNAL_REVERSAL | Duration: 150m
2026-01-09 13:43:25,703 - INFO - OPENED SHORT | Price: 1.17214 | SL: 1.17324 | TP: 1.17159 | Size: 72,841 | Market: BULL
2026-01-09 13:43:25,703 - INFO - OPENED SHORT | Price: 1.17214 | SL: 1.17324 | TP: 1.17159 | Size: 72,841 | Market: BULL
2026-01-09 13:43:25,864 - INFO - CLOSED SHORT | P/L: $40.00 | Reason: TAKE_PROFIT | Duration: 175m
2026-01-09 13:43:25,864 - INFO - CLOSED SHORT | P/L: $40.00 | Reason: TAKE_PROFIT | Duration: 175m
2026-01-09 13:43:26,347 - INFO - OPENED LONG | Price: 1.17194 | SL: 1.16978 | TP: 1.17410 | Size: 55,564 | Market: BULL
2026-01-09 13:43:26,347 - INFO - OPENED LONG | Price: 1.17194 | SL: 1.16978 | TP: 1.17410 | Size: 55,564 | Market: BULL
2026-01-09 13:43:26,722 - INFO - CLOSED LONG | P/L: $-57.79 | Reason: SIGNAL_REVERSAL | Duration: 415m
2026-01-09 13:43:26,722 - INFO - CLOSED LONG | P/L: $-57.79 | Reason: SIGNAL_REVERSAL | Duration: 415m
2026-01-09 13:43:26,722 - INFO - OPENED SHORT | Price: 1.17090 | SL: 1.17262 | TP: 1.17004 | Size: 46,430 | Market: BULL
2026-01-09 13:43:26,722 - INFO - OPENED SHORT | Price: 1.17090 | SL: 1.17262 | TP: 1.17004 | Size: 46,430 | Market: BULL
2026-01-09 13:43:26,873 - INFO - CLOSED SHORT | P/L: $-49.22 | Reason: SIGNAL_REVERSAL | Duration: 2950m
2026-01-09 13:43:26,873 - INFO - CLOSED SHORT | P/L: $-49.22 | Reason: SIGNAL_REVERSAL | Duration: 2950m
2026-01-09 13:43:26,874 - INFO - OPENED LONG | Price: 1.17196 | SL: 1.17061 | TP: 1.17331 | Size: 88,596 | Market: BULL
2026-01-09 13:43:26,874 - INFO - OPENED LONG | Price: 1.17196 | SL: 1.17061 | TP: 1.17331 | Size: 88,596 | Market: BULL
2026-01-09 13:43:27,030 - INFO - CLOSED LONG | P/L: $-104.54 | Reason: SIGNAL_REVERSAL | Duration: 110m
2026-01-09 13:43:27,030 - INFO - CLOSED LONG | P/L: $-104.54 | Reason: SIGNAL_REVERSAL | Duration: 110m
2026-01-09 13:43:27,030 - INFO - OPENED SHORT | Price: 1.17078 | SL: 1.17204 | TP: 1.17015 | Size: 63,377 | Market: BULL
2026-01-09 13:43:27,030 - INFO - OPENED SHORT | Price: 1.17078 | SL: 1.17204 | TP: 1.17015 | Size: 63,377 | Market: BULL
2026-01-09 13:43:27,228 - INFO - CLOSED SHORT | P/L: $-65.91 | Reason: SIGNAL_REVERSAL | Duration: 105m
2026-01-09 13:43:27,228 - INFO - CLOSED SHORT | P/L: $-65.91 | Reason: SIGNAL_REVERSAL | Duration: 105m
2026-01-09 13:43:27,228 - INFO - OPENED LONG | Price: 1.17182 | SL: 1.17083 | TP: 1.17281 | Size: 121,134 | Market: BULL
2026-01-09 13:43:27,228 - INFO - OPENED LONG | Price: 1.17182 | SL: 1.17083 | TP: 1.17281 | Size: 121,134 | Market: BULL
2026-01-09 13:43:27,630 - INFO - CLOSED LONG | P/L: $-21.80 | Reason: SIGNAL_REVERSAL | Duration: 265m
2026-01-09 13:43:27,630 - INFO - CLOSED LONG | P/L: $-21.80 | Reason: SIGNAL_REVERSAL | Duration: 265m
2026-01-09 13:43:27,630 - INFO - OPENED SHORT | Price: 1.17164 | SL: 1.17241 | TP: 1.17125 | Size: 103,639 | Market: BULL
2026-01-09 13:43:27,630 - INFO - OPENED SHORT | Price: 1.17164 | SL: 1.17241 | TP: 1.17125 | Size: 103,639 | Market: BULL
2026-01-09 13:43:27,687 - INFO - CLOSED SHORT | P/L: $-71.51 | Reason: SIGNAL_REVERSAL | Duration: 90m
2026-01-09 13:43:27,687 - INFO - CLOSED SHORT | P/L: $-71.51 | Reason: SIGNAL_REVERSAL | Duration: 90m
2026-01-09 13:43:27,687 - INFO - OPENED LONG | Price: 1.17233 | SL: 1.17113 | TP: 1.17353 | Size: 99,616 | Market: BULL
2026-01-09 13:43:27,687 - INFO - OPENED LONG | Price: 1.17233 | SL: 1.17113 | TP: 1.17353 | Size: 99,616 | Market: BULL
2026-01-09 13:43:27,743 - INFO - CLOSED LONG | P/L: $120.00 | Reason: TAKE_PROFIT | Duration: 80m
2026-01-09 13:43:27,743 - INFO - CLOSED LONG | P/L: $120.00 | Reason: TAKE_PROFIT | Duration: 80m
2026-01-09 13:43:28,177 - INFO - OPENED SHORT | Price: 1.17499 | SL: 1.17722 | TP: 1.17388 | Size: 35,905 | Market: BULL
2026-01-09 13:43:28,177 - INFO - OPENED SHORT | Price: 1.17499 | SL: 1.17722 | TP: 1.17388 | Size: 35,905 | Market: BULL
2026-01-09 13:43:28,444 - INFO - CLOSED SHORT | P/L: $-31.96 | Reason: SIGNAL_REVERSAL | Duration: 275m
2026-01-09 13:43:28,444 - INFO - CLOSED SHORT | P/L: $-31.96 | Reason: SIGNAL_REVERSAL | Duration: 275m
2026-01-09 13:43:28,444 - INFO - OPENED LONG | Price: 1.17588 | SL: 1.17495 | TP: 1.17681 | Size: 129,287 | Market: BULL
2026-01-09 13:43:28,444 - INFO - OPENED LONG | Price: 1.17588 | SL: 1.17495 | TP: 1.17681 | Size: 129,287 | Market: BULL
2026-01-09 13:43:28,608 - INFO - CLOSED LONG | P/L: $120.00 | Reason: TAKE_PROFIT | Duration: 200m
2026-01-09 13:43:28,608 - INFO - CLOSED LONG | P/L: $120.00 | Reason: TAKE_PROFIT | Duration: 200m
2026-01-09 13:43:28,941 - INFO - OPENED SHORT | Price: 1.17698 | SL: 1.17815 | TP: 1.17640 | Size: 68,382 | Market: BULL
2026-01-09 13:43:28,941 - INFO - OPENED SHORT | Price: 1.17698 | SL: 1.17815 | TP: 1.17640 | Size: 68,382 | Market: BULL
2026-01-09 13:43:29,160 - INFO - CLOSED SHORT | P/L: $-77.96 | Reason: SIGNAL_REVERSAL | Duration: 90m
2026-01-09 13:43:29,160 - INFO - CLOSED SHORT | P/L: $-77.96 | Reason: SIGNAL_REVERSAL | Duration: 90m
2026-01-09 13:43:29,160 - INFO - OPENED LONG | Price: 1.17812 | SL: 1.17669 | TP: 1.17955 | Size: 84,202 | Market: BULL
2026-01-09 13:43:29,160 - INFO - OPENED LONG | Price: 1.17812 | SL: 1.17669 | TP: 1.17955 | Size: 84,202 | Market: BULL
2026-01-09 13:43:29,291 - INFO - CLOSED LONG | P/L: $120.00 | Reason: TAKE_PROFIT | Duration: 120m
2026-01-09 13:43:29,291 - INFO - CLOSED LONG | P/L: $120.00 | Reason: TAKE_PROFIT | Duration: 120m
2026-01-09 13:43:29,458 - INFO - OPENED SHORT | Price: 1.17858 | SL: 1.18034 | TP: 1.17770 | Size: 45,520 | Market: BULL
2026-01-09 13:43:29,458 - INFO - OPENED SHORT | Price: 1.17858 | SL: 1.18034 | TP: 1.17770 | Size: 45,520 | Market: BULL
2026-01-09 13:43:29,460 - INFO - CLOSED SHORT | P/L: $40.00 | Reason: TAKE_PROFIT | Duration: 50m
2026-01-09 13:43:29,460 - INFO - CLOSED SHORT | P/L: $40.00 | Reason: TAKE_PROFIT | Duration: 50m
2026-01-09 13:43:29,802 - INFO - OPENED LONG | Price: 1.17794 | SL: 1.17669 | TP: 1.17919 | Size: 96,155 | Market: BULL
2026-01-09 13:43:29,802 - INFO - OPENED LONG | Price: 1.17794 | SL: 1.17669 | TP: 1.17919 | Size: 96,155 | Market: BULL
2026-01-09 13:43:29,925 - INFO - CLOSED LONG | P/L: $120.00 | Reason: TAKE_PROFIT | Duration: 90m
2026-01-09 13:43:29,925 - INFO - CLOSED LONG | P/L: $120.00 | Reason: TAKE_PROFIT | Duration: 90m
2026-01-09 13:43:30,545 - INFO - OPENED SHORT | Price: 1.17920 | SL: 1.18046 | TP: 1.17857 | Size: 63,396 | Market: BULL
2026-01-09 13:43:30,545 - INFO - OPENED SHORT | Price: 1.17920 | SL: 1.18046 | TP: 1.17857 | Size: 63,396 | Market: BULL
2026-01-09 13:43:30,677 - INFO - CLOSED SHORT | P/L: $-43.11 | Reason: SIGNAL_REVERSAL | Duration: 155m
2026-01-09 13:43:30,677 - INFO - CLOSED SHORT | P/L: $-43.11 | Reason: SIGNAL_REVERSAL | Duration: 155m
2026-01-09 13:43:30,677 - INFO - OPENED LONG | Price: 1.17988 | SL: 1.17864 | TP: 1.18112 | Size: 96,537 | Market: BULL
2026-01-09 13:43:30,677 - INFO - OPENED LONG | Price: 1.17988 | SL: 1.17864 | TP: 1.18112 | Size: 96,537 | Market: BULL
2026-01-09 13:43:30,784 - INFO - CLOSED LONG | P/L: $-86.88 | Reason: SIGNAL_REVERSAL | Duration: 110m
2026-01-09 13:43:30,784 - INFO - CLOSED LONG | P/L: $-86.88 | Reason: SIGNAL_REVERSAL | Duration: 110m
2026-01-09 13:43:30,784 - INFO - OPENED SHORT | Price: 1.17898 | SL: 1.18083 | TP: 1.17805 | Size: 43,204 | Market: BULL
2026-01-09 13:43:30,784 - INFO - OPENED SHORT | Price: 1.17898 | SL: 1.18083 | TP: 1.17805 | Size: 43,204 | Market: BULL
2026-01-09 13:43:31,011 - INFO - Progress: 40.0% (2000/4999)
2026-01-09 13:43:31,011 - INFO - Progress: 40.0% (2000/4999)
2026-01-09 13:43:31,175 - INFO - CLOSED SHORT | P/L: $40.00 | Reason: TAKE_PROFIT | Duration: 440m
2026-01-09 13:43:31,175 - INFO - CLOSED SHORT | P/L: $40.00 | Reason: TAKE_PROFIT | Duration: 440m
2026-01-09 13:43:31,441 - INFO - OPENED LONG | Price: 1.17810 | SL: 1.17765 | TP: 1.17855 | Size: 263,935 | Market: BULL
2026-01-09 13:43:31,441 - INFO - OPENED LONG | Price: 1.17810 | SL: 1.17765 | TP: 1.17855 | Size: 263,935 | Market: BULL
2026-01-09 13:43:31,548 - INFO - CLOSED LONG | P/L: $-73.90 | Reason: SIGNAL_REVERSAL | Duration: 100m
2026-01-09 13:43:31,548 - INFO - CLOSED LONG | P/L: $-73.90 | Reason: SIGNAL_REVERSAL | Duration: 100m
2026-01-09 13:43:31,548 - INFO - OPENED SHORT | Price: 1.17782 | SL: 1.17830 | TP: 1.17758 | Size: 166,233 | Market: BULL
2026-01-09 13:43:31,548 - INFO - OPENED SHORT | Price: 1.17782 | SL: 1.17830 | TP: 1.17758 | Size: 166,233 | Market: BULL
2026-01-09 13:43:31,602 - INFO - CLOSED SHORT | P/L: $-80.00 | Reason: STOP_LOSS | Duration: 1500m
2026-01-09 13:43:31,602 - INFO - CLOSED SHORT | P/L: $-80.00 | Reason: STOP_LOSS | Duration: 1500m
2026-01-09 13:43:31,602 - INFO - OPENED LONG | Price: 1.17844 | SL: 1.17732 | TP: 1.17956 | Size: 107,316 | Market: BULL
2026-01-09 13:43:31,602 - INFO - OPENED LONG | Price: 1.17844 | SL: 1.17732 | TP: 1.17956 | Size: 107,316 | Market: BULL
2026-01-09 13:43:31,872 - INFO - CLOSED LONG | P/L: $7.51 | Reason: SIGNAL_REVERSAL | Duration: 325m
2026-01-09 13:43:31,872 - INFO - CLOSED LONG | P/L: $7.51 | Reason: SIGNAL_REVERSAL | Duration: 325m
2026-01-09 13:43:31,872 - INFO - OPENED SHORT | Price: 1.17851 | SL: 1.17959 | TP: 1.17797 | Size: 74,303 | Market: BULL
2026-01-09 13:43:31,872 - INFO - OPENED SHORT | Price: 1.17851 | SL: 1.17959 | TP: 1.17797 | Size: 74,303 | Market: BULL
2026-01-09 13:43:32,034 - INFO - CLOSED SHORT | P/L: $40.00 | Reason: TAKE_PROFIT | Duration: 185m
2026-01-09 13:43:32,034 - INFO - CLOSED SHORT | P/L: $40.00 | Reason: TAKE_PROFIT | Duration: 185m
2026-01-09 13:43:32,249 - INFO - OPENED LONG | Price: 1.17779 | SL: 1.17636 | TP: 1.17922 | Size: 84,114 | Market: BULL
2026-01-09 13:43:32,249 - INFO - OPENED LONG | Price: 1.17779 | SL: 1.17636 | TP: 1.17922 | Size: 84,114 | Market: BULL
2026-01-09 13:43:32,412 - INFO - CLOSED LONG | P/L: $120.00 | Reason: TAKE_PROFIT | Duration: 165m
2026-01-09 13:43:32,412 - INFO - CLOSED LONG | P/L: $120.00 | Reason: TAKE_PROFIT | Duration: 165m
2026-01-09 13:43:32,521 - INFO - OPENED SHORT | Price: 1.17745 | SL: 1.17966 | TP: 1.17635 | Size: 36,232 | Market: BULL
2026-01-09 13:43:32,521 - INFO - OPENED SHORT | Price: 1.17745 | SL: 1.17966 | TP: 1.17635 | Size: 36,232 | Market: BULL
2026-01-09 13:43:32,575 - INFO - CLOSED SHORT | P/L: $40.00 | Reason: TAKE_PROFIT | Duration: 60m
2026-01-09 13:43:32,575 - INFO - CLOSED SHORT | P/L: $40.00 | Reason: TAKE_PROFIT | Duration: 60m
2026-01-09 13:43:32,736 - INFO - OPENED LONG | Price: 1.17752 | SL: 1.17634 | TP: 1.17870 | Size: 101,732 | Market: BULL
2026-01-09 13:43:32,736 - INFO - OPENED LONG | Price: 1.17752 | SL: 1.17634 | TP: 1.17870 | Size: 101,732 | Market: BULL
2026-01-09 13:43:32,848 - INFO - CLOSED LONG | P/L: $-59.00 | Reason: SIGNAL_REVERSAL | Duration: 115m
2026-01-09 13:43:32,848 - INFO - CLOSED LONG | P/L: $-59.00 | Reason: SIGNAL_REVERSAL | Duration: 115m
2026-01-09 13:43:32,848 - INFO - OPENED SHORT | Price: 1.17694 | SL: 1.17826 | TP: 1.17628 | Size: 60,521 | Market: BULL
2026-01-09 13:43:32,848 - INFO - OPENED SHORT | Price: 1.17694 | SL: 1.17826 | TP: 1.17628 | Size: 60,521 | Market: BULL
2026-01-09 13:43:32,953 - INFO - CLOSED SHORT | P/L: $-49.63 | Reason: SIGNAL_REVERSAL | Duration: 2980m
2026-01-09 13:43:32,953 - INFO - CLOSED SHORT | P/L: $-49.63 | Reason: SIGNAL_REVERSAL | Duration: 2980m
2026-01-09 13:43:32,953 - INFO - OPENED LONG | Price: 1.17776 | SL: 1.17643 | TP: 1.17909 | Size: 90,505 | Market: BULL
2026-01-09 13:43:32,953 - INFO - OPENED LONG | Price: 1.17776 | SL: 1.17643 | TP: 1.17909 | Size: 90,505 | Market: BULL
2026-01-09 13:43:33,124 - INFO - CLOSED LONG | P/L: $-16.29 | Reason: SIGNAL_REVERSAL | Duration: 220m
2026-01-09 13:43:33,124 - INFO - CLOSED LONG | P/L: $-16.29 | Reason: SIGNAL_REVERSAL | Duration: 220m
2026-01-09 13:43:33,124 - INFO - OPENED SHORT | Price: 1.17758 | SL: 1.17864 | TP: 1.17705 | Size: 75,422 | Market: BULL
2026-01-09 13:43:33,124 - INFO - OPENED SHORT | Price: 1.17758 | SL: 1.17864 | TP: 1.17705 | Size: 75,422 | Market: BULL
2026-01-09 13:43:33,228 - INFO - CLOSED SHORT | P/L: $40.00 | Reason: TAKE_PROFIT | Duration: 65m
2026-01-09 13:43:33,228 - INFO - CLOSED SHORT | P/L: $40.00 | Reason: TAKE_PROFIT | Duration: 65m
2026-01-09 13:43:33,337 - INFO - OPENED LONG | Price: 1.17696 | SL: 1.17535 | TP: 1.17857 | Size: 74,529 | Market: BULL
2026-01-09 13:43:33,337 - INFO - OPENED LONG | Price: 1.17696 | SL: 1.17535 | TP: 1.17857 | Size: 74,529 | Market: BULL
2026-01-09 13:43:33,444 - INFO - CLOSED LONG | P/L: $120.00 | Reason: TAKE_PROFIT | Duration: 115m
2026-01-09 13:43:33,444 - INFO - CLOSED LONG | P/L: $120.00 | Reason: TAKE_PROFIT | Duration: 115m
2026-01-09 13:43:33,551 - INFO - OPENED SHORT | Price: 1.17658 | SL: 1.17889 | TP: 1.17543 | Size: 34,643 | Market: BULL
2026-01-09 13:43:33,551 - INFO - OPENED SHORT | Price: 1.17658 | SL: 1.17889 | TP: 1.17543 | Size: 34,643 | Market: BULL
2026-01-09 13:43:33,764 - INFO - CLOSED SHORT | P/L: $-28.41 | Reason: SIGNAL_REVERSAL | Duration: 205m
2026-01-09 13:43:33,764 - INFO - CLOSED SHORT | P/L: $-28.41 | Reason: SIGNAL_REVERSAL | Duration: 205m
2026-01-09 13:43:33,764 - INFO - OPENED LONG | Price: 1.17740 | SL: 1.17559 | TP: 1.17921 | Size: 66,193 | Market: BULL
2026-01-09 13:43:33,764 - INFO - OPENED LONG | Price: 1.17740 | SL: 1.17559 | TP: 1.17921 | Size: 66,193 | Market: BULL
2026-01-09 13:43:33,873 - INFO - CLOSED LONG | P/L: $-67.52 | Reason: SIGNAL_REVERSAL | Duration: 105m
2026-01-09 13:43:33,873 - INFO - CLOSED LONG | P/L: $-67.52 | Reason: SIGNAL_REVERSAL | Duration: 105m
2026-01-09 13:43:33,873 - INFO - OPENED SHORT | Price: 1.17638 | SL: 1.17873 | TP: 1.17521 | Size: 34,079 | Market: BULL
2026-01-09 13:43:33,873 - INFO - OPENED SHORT | Price: 1.17638 | SL: 1.17873 | TP: 1.17521 | Size: 34,079 | Market: BULL
2026-01-09 13:43:33,928 - INFO - CLOSED SHORT | P/L: $40.00 | Reason: TAKE_PROFIT | Duration: 75m
2026-01-09 13:43:33,928 - INFO - CLOSED SHORT | P/L: $40.00 | Reason: TAKE_PROFIT | Duration: 75m
2026-01-09 13:43:34,036 - INFO - OPENED LONG | Price: 1.17628 | SL: 1.17508 | TP: 1.17748 | Size: 99,600 | Market: BULL
2026-01-09 13:43:34,036 - INFO - OPENED LONG | Price: 1.17628 | SL: 1.17508 | TP: 1.17748 | Size: 99,600 | Market: BULL
2026-01-09 13:43:34,359 - INFO - CLOSED LONG | P/L: $120.00 | Reason: TAKE_PROFIT | Duration: 385m
2026-01-09 13:43:34,359 - INFO - CLOSED LONG | P/L: $120.00 | Reason: TAKE_PROFIT | Duration: 385m
2026-01-09 13:43:34,679 - INFO - OPENED SHORT | Price: 1.17676 | SL: 1.17831 | TP: 1.17599 | Size: 51,658 | Market: BULL
2026-01-09 13:43:34,679 - INFO - OPENED SHORT | Price: 1.17676 | SL: 1.17831 | TP: 1.17599 | Size: 51,658 | Market: BULL
2026-01-09 13:43:34,997 - INFO - CLOSED SHORT | P/L: $40.00 | Reason: TAKE_PROFIT | Duration: 340m
2026-01-09 13:43:34,997 - INFO - CLOSED SHORT | P/L: $40.00 | Reason: TAKE_PROFIT | Duration: 340m
2026-01-09 13:43:35,485 - INFO - Progress: 60.0% (3000/4999)
2026-01-09 13:43:35,485 - INFO - Progress: 60.0% (3000/4999)
2026-01-09 13:43:36,122 - INFO - OPENED LONG | Price: 1.17422 | SL: 1.17271 | TP: 1.17497 | Size: 53,118 | Market: BEAR
2026-01-09 13:43:36,122 - INFO - OPENED LONG | Price: 1.17422 | SL: 1.17271 | TP: 1.17497 | Size: 53,118 | Market: BEAR
2026-01-09 13:43:36,226 - INFO - CLOSED LONG | P/L: $40.00 | Reason: TAKE_PROFIT | Duration: 75m
2026-01-09 13:43:36,226 - INFO - CLOSED LONG | P/L: $40.00 | Reason: TAKE_PROFIT | Duration: 75m
2026-01-09 13:43:36,334 - INFO - OPENED SHORT | Price: 1.17392 | SL: 1.17608 | TP: 1.17176 | Size: 55,470 | Market: BEAR
2026-01-09 13:43:36,334 - INFO - OPENED SHORT | Price: 1.17392 | SL: 1.17608 | TP: 1.17176 | Size: 55,470 | Market: BEAR
2026-01-09 13:43:36,659 - INFO - CLOSED SHORT | P/L: $-25.52 | Reason: SIGNAL_REVERSAL | Duration: 360m
2026-01-09 13:43:36,659 - INFO - CLOSED SHORT | P/L: $-25.52 | Reason: SIGNAL_REVERSAL | Duration: 360m
2026-01-09 13:43:36,659 - INFO - OPENED LONG | Price: 1.17438 | SL: 1.17306 | TP: 1.17504 | Size: 60,762 | Market: BEAR
2026-01-09 13:43:36,659 - INFO - OPENED LONG | Price: 1.17438 | SL: 1.17306 | TP: 1.17504 | Size: 60,762 | Market: BEAR
2026-01-09 13:43:36,662 - INFO - CLOSED LONG | P/L: $40.00 | Reason: TAKE_PROFIT | Duration: 50m
2026-01-09 13:43:36,662 - INFO - CLOSED LONG | P/L: $40.00 | Reason: TAKE_PROFIT | Duration: 50m
2026-01-09 13:43:37,086 - INFO - OPENED SHORT | Price: 1.17568 | SL: 1.17656 | TP: 1.17480 | Size: 135,633 | Market: BEAR
2026-01-09 13:43:37,086 - INFO - OPENED SHORT | Price: 1.17568 | SL: 1.17656 | TP: 1.17480 | Size: 135,633 | Market: BEAR
2026-01-09 13:43:37,192 - INFO - CLOSED SHORT | P/L: $120.00 | Reason: TAKE_PROFIT | Duration: 100m
2026-01-09 13:43:37,192 - INFO - CLOSED SHORT | P/L: $120.00 | Reason: TAKE_PROFIT | Duration: 100m
2026-01-09 13:43:37,704 - INFO - OPENED LONG | Price: 1.17333 | SL: 1.17161 | TP: 1.17419 | Size: 46,519 | Market: BEAR
2026-01-09 13:43:37,704 - INFO - OPENED LONG | Price: 1.17333 | SL: 1.17161 | TP: 1.17419 | Size: 46,519 | Market: BEAR
2026-01-09 13:43:37,707 - INFO - CLOSED LONG | P/L: $40.00 | Reason: TAKE_PROFIT | Duration: 50m
2026-01-09 13:43:37,707 - INFO - CLOSED LONG | P/L: $40.00 | Reason: TAKE_PROFIT | Duration: 50m
2026-01-09 13:43:37,813 - INFO - OPENED SHORT | Price: 1.17316 | SL: 1.17522 | TP: 1.17110 | Size: 58,295 | Market: BEAR
2026-01-09 13:43:37,813 - INFO - OPENED SHORT | Price: 1.17316 | SL: 1.17522 | TP: 1.17110 | Size: 58,295 | Market: BEAR
2026-01-09 13:43:38,131 - INFO - CLOSED SHORT | P/L: $120.00 | Reason: TAKE_PROFIT | Duration: 3220m
2026-01-09 13:43:38,131 - INFO - CLOSED SHORT | P/L: $120.00 | Reason: TAKE_PROFIT | Duration: 3220m
2026-01-09 13:43:38,457 - INFO - OPENED LONG | Price: 1.16848 | SL: 1.16742 | TP: 1.16901 | Size: 75,534 | Market: BEAR
2026-01-09 13:43:38,457 - INFO - OPENED LONG | Price: 1.16848 | SL: 1.16742 | TP: 1.16901 | Size: 75,534 | Market: BEAR
2026-01-09 13:43:38,511 - INFO - CLOSED LONG | P/L: $40.00 | Reason: TAKE_PROFIT | Duration: 65m
2026-01-09 13:43:38,511 - INFO - CLOSED LONG | P/L: $40.00 | Reason: TAKE_PROFIT | Duration: 65m
2026-01-09 13:43:38,672 - INFO - OPENED SHORT | Price: 1.16757 | SL: 1.16960 | TP: 1.16554 | Size: 58,990 | Market: BEAR
2026-01-09 13:43:38,672 - INFO - OPENED SHORT | Price: 1.16757 | SL: 1.16960 | TP: 1.16554 | Size: 58,990 | Market: BEAR
2026-01-09 13:43:38,989 - INFO - CLOSED SHORT | P/L: $-107.95 | Reason: SIGNAL_REVERSAL | Duration: 320m
2026-01-09 13:43:38,989 - INFO - CLOSED SHORT | P/L: $-107.95 | Reason: SIGNAL_REVERSAL | Duration: 320m
2026-01-09 13:43:38,990 - INFO - OPENED LONG | Price: 1.16940 | SL: 1.16622 | TP: 1.17099 | Size: 25,135 | Market: BEAR
2026-01-09 13:43:38,990 - INFO - OPENED LONG | Price: 1.16940 | SL: 1.16622 | TP: 1.17099 | Size: 25,135 | Market: BEAR
2026-01-09 13:43:39,043 - INFO - CLOSED LONG | P/L: $40.00 | Reason: TAKE_PROFIT | Duration: 70m
2026-01-09 13:43:39,043 - INFO - CLOSED LONG | P/L: $40.00 | Reason: TAKE_PROFIT | Duration: 70m
2026-01-09 13:43:39,312 - INFO - OPENED SHORT | Price: 1.17206 | SL: 1.17307 | TP: 1.17105 | Size: 118,777 | Market: BEAR
2026-01-09 13:43:39,312 - INFO - OPENED SHORT | Price: 1.17206 | SL: 1.17307 | TP: 1.17105 | Size: 118,777 | Market: BEAR
2026-01-09 13:43:39,525 - INFO - CLOSED SHORT | P/L: $2.38 | Reason: SIGNAL_REVERSAL | Duration: 240m
2026-01-09 13:43:39,525 - INFO - CLOSED SHORT | P/L: $2.38 | Reason: SIGNAL_REVERSAL | Duration: 240m
2026-01-09 13:43:39,525 - INFO - OPENED LONG | Price: 1.17204 | SL: 1.17093 | TP: 1.17259 | Size: 72,297 | Market: BEAR
2026-01-09 13:43:39,525 - INFO - OPENED LONG | Price: 1.17204 | SL: 1.17093 | TP: 1.17259 | Size: 72,297 | Market: BEAR
2026-01-09 13:43:39,579 - INFO - CLOSED LONG | P/L: $40.00 | Reason: TAKE_PROFIT | Duration: 60m
2026-01-09 13:43:39,579 - INFO - CLOSED LONG | P/L: $40.00 | Reason: TAKE_PROFIT | Duration: 60m
2026-01-09 13:43:39,739 - INFO - OPENED SHORT | Price: 1.17300 | SL: 1.17387 | TP: 1.17213 | Size: 138,310 | Market: BEAR
2026-01-09 13:43:39,739 - INFO - OPENED SHORT | Price: 1.17300 | SL: 1.17387 | TP: 1.17213 | Size: 138,310 | Market: BEAR
2026-01-09 13:43:39,843 - INFO - CLOSED SHORT | P/L: $-120.00 | Reason: STOP_LOSS | Duration: 70m
2026-01-09 13:43:39,843 - INFO - CLOSED SHORT | P/L: $-120.00 | Reason: STOP_LOSS | Duration: 70m
2026-01-09 13:43:39,844 - INFO - OPENED LONG | Price: 1.17406 | SL: 1.17271 | TP: 1.17473 | Size: 59,377 | Market: BEAR
2026-01-09 13:43:39,844 - INFO - OPENED LONG | Price: 1.17406 | SL: 1.17271 | TP: 1.17473 | Size: 59,377 | Market: BEAR
2026-01-09 13:43:39,847 - INFO - CLOSED LONG | P/L: $-68.28 | Reason: SIGNAL_REVERSAL | Duration: 55m
2026-01-09 13:43:39,847 - INFO - CLOSED LONG | P/L: $-68.28 | Reason: SIGNAL_REVERSAL | Duration: 55m
2026-01-09 13:43:39,847 - INFO - OPENED SHORT | Price: 1.17291 | SL: 1.17451 | TP: 1.17131 | Size: 75,087 | Market: BEAR
2026-01-09 13:43:39,847 - INFO - OPENED SHORT | Price: 1.17291 | SL: 1.17451 | TP: 1.17131 | Size: 75,087 | Market: BEAR
2026-01-09 13:43:39,952 - INFO - CLOSED SHORT | P/L: $120.00 | Reason: TAKE_PROFIT | Duration: 85m
2026-01-09 13:43:39,952 - INFO - CLOSED SHORT | P/L: $120.00 | Reason: TAKE_PROFIT | Duration: 85m
2026-01-09 13:43:40,006 - INFO - Progress: 80.0% (4000/4999)
2026-01-09 13:43:40,006 - INFO - Progress: 80.0% (4000/4999)
2026-01-09 13:43:40,226 - INFO - OPENED LONG | Price: 1.17143 | SL: 1.16968 | TP: 1.17230 | Size: 45,801 | Market: BEAR
2026-01-09 13:43:40,226 - INFO - OPENED LONG | Price: 1.17143 | SL: 1.16968 | TP: 1.17230 | Size: 45,801 | Market: BEAR
2026-01-09 13:43:40,280 - INFO - CLOSED LONG | P/L: $-80.00 | Reason: STOP_LOSS | Duration: 70m
2026-01-09 13:43:40,280 - INFO - CLOSED LONG | P/L: $-80.00 | Reason: STOP_LOSS | Duration: 70m
2026-01-09 13:43:40,281 - INFO - OPENED SHORT | Price: 1.16958 | SL: 1.17228 | TP: 1.16688 | Size: 44,380 | Market: BEAR
2026-01-09 13:43:40,281 - INFO - OPENED SHORT | Price: 1.16958 | SL: 1.17228 | TP: 1.16688 | Size: 44,380 | Market: BEAR
2026-01-09 13:43:40,440 - INFO - CLOSED SHORT | P/L: $-23.97 | Reason: SIGNAL_REVERSAL | Duration: 170m
2026-01-09 13:43:40,440 - INFO - CLOSED SHORT | P/L: $-23.97 | Reason: SIGNAL_REVERSAL | Duration: 170m
2026-01-09 13:43:40,440 - INFO - OPENED LONG | Price: 1.17012 | SL: 1.16871 | TP: 1.17082 | Size: 56,822 | Market: BEAR
2026-01-09 13:43:40,440 - INFO - OPENED LONG | Price: 1.17012 | SL: 1.16871 | TP: 1.17082 | Size: 56,822 | Market: BEAR
2026-01-09 13:43:40,443 - INFO - CLOSED LONG | P/L: $-78.41 | Reason: SIGNAL_REVERSAL | Duration: 50m
2026-01-09 13:43:40,443 - INFO - CLOSED LONG | P/L: $-78.41 | Reason: SIGNAL_REVERSAL | Duration: 50m
2026-01-09 13:43:40,443 - INFO - OPENED SHORT | Price: 1.16874 | SL: 1.17046 | TP: 1.16702 | Size: 69,763 | Market: BEAR
2026-01-09 13:43:40,443 - INFO - OPENED SHORT | Price: 1.16874 | SL: 1.17046 | TP: 1.16702 | Size: 69,763 | Market: BEAR
2026-01-09 13:43:40,762 - INFO - CLOSED SHORT | P/L: $-25.81 | Reason: SIGNAL_REVERSAL | Duration: 340m
2026-01-09 13:43:40,762 - INFO - CLOSED SHORT | P/L: $-25.81 | Reason: SIGNAL_REVERSAL | Duration: 340m
2026-01-09 13:43:40,762 - INFO - OPENED LONG | Price: 1.16911 | SL: 1.16850 | TP: 1.16941 | Size: 131,657 | Market: BEAR
2026-01-09 13:43:40,762 - INFO - OPENED LONG | Price: 1.16911 | SL: 1.16850 | TP: 1.16941 | Size: 131,657 | Market: BEAR
2026-01-09 13:43:40,762 - INFO - CLOSED LONG | P/L: $40.00 | Reason: TAKE_PROFIT | Duration: 5m
2026-01-09 13:43:40,762 - INFO - CLOSED LONG | P/L: $40.00 | Reason: TAKE_PROFIT | Duration: 5m
2026-01-09 13:43:40,977 - INFO - OPENED SHORT | Price: 1.16934 | SL: 1.17045 | TP: 1.16823 | Size: 108,548 | Market: BEAR
2026-01-09 13:43:40,977 - INFO - OPENED SHORT | Price: 1.16934 | SL: 1.17045 | TP: 1.16823 | Size: 108,548 | Market: BEAR
2026-01-09 13:43:41,084 - INFO - CLOSED SHORT | P/L: $-60.79 | Reason: SIGNAL_REVERSAL | Duration: 120m
2026-01-09 13:43:41,084 - INFO - CLOSED SHORT | P/L: $-60.79 | Reason: SIGNAL_REVERSAL | Duration: 120m
2026-01-09 13:43:41,084 - INFO - OPENED LONG | Price: 1.16990 | SL: 1.16893 | TP: 1.17038 | Size: 82,615 | Market: BEAR
2026-01-09 13:43:41,084 - INFO - OPENED LONG | Price: 1.16990 | SL: 1.16893 | TP: 1.17038 | Size: 82,615 | Market: BEAR
2026-01-09 13:43:41,137 - INFO - CLOSED LONG | P/L: $-80.00 | Reason: STOP_LOSS | Duration: 40m
2026-01-09 13:43:41,137 - INFO - CLOSED LONG | P/L: $-80.00 | Reason: STOP_LOSS | Duration: 40m
2026-01-09 13:43:41,137 - INFO - OPENED SHORT | Price: 1.16864 | SL: 1.17032 | TP: 1.16696 | Size: 71,501 | Market: BEAR
2026-01-09 13:43:41,137 - INFO - OPENED SHORT | Price: 1.16864 | SL: 1.17032 | TP: 1.16696 | Size: 71,501 | Market: BEAR
2026-01-09 13:43:41,351 - INFO - CLOSED SHORT | P/L: $-42.90 | Reason: SIGNAL_REVERSAL | Duration: 225m
2026-01-09 13:43:41,351 - INFO - CLOSED SHORT | P/L: $-42.90 | Reason: SIGNAL_REVERSAL | Duration: 225m
2026-01-09 13:43:41,351 - INFO - OPENED LONG | Price: 1.16924 | SL: 1.16752 | TP: 1.17010 | Size: 46,602 | Market: BEAR
2026-01-09 13:43:41,351 - INFO - OPENED LONG | Price: 1.16924 | SL: 1.16752 | TP: 1.17010 | Size: 46,602 | Market: BEAR
2026-01-09 13:43:41,728 - INFO - CLOSED LONG | P/L: $-43.81 | Reason: SIGNAL_REVERSAL | Duration: 460m
2026-01-09 13:43:41,728 - INFO - CLOSED LONG | P/L: $-43.81 | Reason: SIGNAL_REVERSAL | Duration: 460m
2026-01-09 13:43:41,728 - INFO - OPENED SHORT | Price: 1.16830 | SL: 1.16959 | TP: 1.16701 | Size: 93,126 | Market: BEAR
2026-01-09 13:43:41,728 - INFO - OPENED SHORT | Price: 1.16830 | SL: 1.16959 | TP: 1.16701 | Size: 93,126 | Market: BEAR
2026-01-09 13:43:42,156 - INFO - CLOSED SHORT | P/L: $29.80 | Reason: SIGNAL_REVERSAL | Duration: 465m
2026-01-09 13:43:42,156 - INFO - CLOSED SHORT | P/L: $29.80 | Reason: SIGNAL_REVERSAL | Duration: 465m
2026-01-09 13:43:42,156 - INFO - OPENED LONG | Price: 1.16798 | SL: 1.16700 | TP: 1.16847 | Size: 81,324 | Market: BEAR
2026-01-09 13:43:42,156 - INFO - OPENED LONG | Price: 1.16798 | SL: 1.16700 | TP: 1.16847 | Size: 81,324 | Market: BEAR
2026-01-09 13:43:42,487 - INFO - CLOSED LONG | P/L: $-47.98 | Reason: SIGNAL_REVERSAL | Duration: 335m
2026-01-09 13:43:42,487 - INFO - CLOSED LONG | P/L: $-47.98 | Reason: SIGNAL_REVERSAL | Duration: 335m
2026-01-09 13:43:42,487 - INFO - OPENED SHORT | Price: 1.16739 | SL: 1.16849 | TP: 1.16629 | Size: 109,352 | Market: BEAR
2026-01-09 13:43:42,487 - INFO - OPENED SHORT | Price: 1.16739 | SL: 1.16849 | TP: 1.16629 | Size: 109,352 | Market: BEAR
2026-01-09 13:43:42,764 - INFO - CLOSED SHORT | P/L: $120.00 | Reason: TAKE_PROFIT | Duration: 330m
2026-01-09 13:43:42,764 - INFO - CLOSED SHORT | P/L: $120.00 | Reason: TAKE_PROFIT | Duration: 330m
2026-01-09 13:43:43,147 - INFO - OPENED LONG | Price: 1.16532 | SL: 1.16433 | TP: 1.16581 | Size: 80,815 | Market: BEAR
2026-01-09 13:43:43,147 - INFO - OPENED LONG | Price: 1.16532 | SL: 1.16433 | TP: 1.16581 | Size: 80,815 | Market: BEAR
2026-01-09 13:43:43,203 - INFO - CLOSED LONG | P/L: $40.00 | Reason: TAKE_PROFIT | Duration: 75m
2026-01-09 13:43:43,203 - INFO - CLOSED LONG | P/L: $40.00 | Reason: TAKE_PROFIT | Duration: 75m
2026-01-09 13:43:43,365 - INFO - OPENED SHORT | Price: 1.16550 | SL: 1.16619 | TP: 1.16481 | Size: 174,020 | Market: BEAR
2026-01-09 13:43:43,365 - INFO - OPENED SHORT | Price: 1.16550 | SL: 1.16619 | TP: 1.16481 | Size: 174,020 | Market: BEAR
2026-01-09 13:43:43,475 - INFO - CLOSED SHORT | P/L: $120.00 | Reason: TAKE_PROFIT | Duration: 115m
2026-01-09 13:43:43,475 - INFO - CLOSED SHORT | P/L: $120.00 | Reason: TAKE_PROFIT | Duration: 115m
2026-01-09 13:43:43,531 - INFO - OPENED LONG | Price: 1.16571 | SL: 1.16440 | TP: 1.16636 | Size: 61,287 | Market: BEAR
2026-01-09 13:43:43,531 - INFO - OPENED LONG | Price: 1.16571 | SL: 1.16440 | TP: 1.16636 | Size: 61,287 | Market: BEAR
2026-01-09 13:43:43,651 - INFO - CLOSED LONG | P/L: $-38.61 | Reason: SIGNAL_REVERSAL | Duration: 150m
2026-01-09 13:43:43,651 - INFO - CLOSED LONG | P/L: $-38.61 | Reason: SIGNAL_REVERSAL | Duration: 150m
2026-01-09 13:43:43,651 - INFO - OPENED SHORT | Price: 1.16508 | SL: 1.16588 | TP: 1.16428 | Size: 149,951 | Market: BEAR
2026-01-09 13:43:43,651 - INFO - OPENED SHORT | Price: 1.16508 | SL: 1.16588 | TP: 1.16428 | Size: 149,951 | Market: BEAR
2026-01-09 13:43:43,760 - INFO - CLOSED SHORT | P/L: $120.00 | Reason: TAKE_PROFIT | Duration: 115m
2026-01-09 13:43:43,760 - INFO - CLOSED SHORT | P/L: $120.00 | Reason: TAKE_PROFIT | Duration: 115m
2026-01-09 13:43:44,089 - INFO - OPENED LONG | Price: 1.16516 | SL: 1.16378 | TP: 1.16585 | Size: 57,881 | Market: BEAR
2026-01-09 13:43:44,089 - INFO - OPENED LONG | Price: 1.16516 | SL: 1.16378 | TP: 1.16585 | Size: 57,881 | Market: BEAR
2026-01-09 13:43:44,163 - INFO - CLOSED LONG | P/L: $-77.56 | Reason: SIGNAL_REVERSAL | Duration: 55m
2026-01-09 13:43:44,163 - INFO - CLOSED LONG | P/L: $-77.56 | Reason: SIGNAL_REVERSAL | Duration: 55m
2026-01-09 13:43:44,164 - INFO - OPENED SHORT | Price: 1.16382 | SL: 1.16666 | TP: 1.16098 | Size: 42,291 | Market: BEAR
2026-01-09 13:43:44,164 - INFO - OPENED SHORT | Price: 1.16382 | SL: 1.16666 | TP: 1.16098 | Size: 42,291 | Market: BEAR
2026-01-09 13:43:44,549 - INFO - CLOSED SHORT | P/L: $0.00 | Reason: SIGNAL_REVERSAL | Duration: 250m
2026-01-09 13:43:44,549 - INFO - CLOSED SHORT | P/L: $0.00 | Reason: SIGNAL_REVERSAL | Duration: 250m
2026-01-09 13:43:44,549 - INFO - OPENED LONG | Price: 1.16382 | SL: 1.16270 | TP: 1.16438 | Size: 71,472 | Market: BEAR
2026-01-09 13:43:44,549 - INFO - OPENED LONG | Price: 1.16382 | SL: 1.16270 | TP: 1.16438 | Size: 71,472 | Market: BEAR
2026-01-09 13:43:44,718 - INFO - CLOSED LONG | P/L: $-50.03 | Reason: SIGNAL_REVERSAL | Duration: 180m
2026-01-09 13:43:44,718 - INFO - CLOSED LONG | P/L: $-50.03 | Reason: SIGNAL_REVERSAL | Duration: 180m
2026-01-09 13:43:44,718 - INFO - OPENED SHORT | Price: 1.16312 | SL: 1.16400 | TP: 1.16224 | Size: 135,808 | Market: BEAR
2026-01-09 13:43:44,718 - INFO - OPENED SHORT | Price: 1.16312 | SL: 1.16400 | TP: 1.16224 | Size: 135,808 | Market: BEAR
2026-01-09 13:43:44,718 - INFO - CLOSED SHORT | P/L: $0.00 | Reason: BACKTEST_END | Duration: 0m
2026-01-09 13:43:44,718 - INFO - CLOSED SHORT | P/L: $0.00 | Reason: BACKTEST_END | Duration: 0m
2026-01-09 13:43:44,719 - INFO - Backtest completed. Total trades: 89
2026-01-09 13:43:44,719 - INFO - Backtest completed. Total trades: 89
Downloading historical data...
Running backtest...

============================================================
BACKTEST RESULTS
============================================================
Instrument: EUR_USD
Period: 30 days
Total Trades: 89
Win Rate: 43.8%
Total Return: $-427.30
Return %: -4.27%
Profit Factor: 0.86
Final Balance: $9572.70
/Users/dongchen/Documents/AI-project/GitHub/ppsupertrend/venv/lib/python3.9/site-packages/urllib3/__init__.py:35: NotOpenSSLWarning: urllib3 v2 only supports OpenSSL 1.1.1+, currently the 'ssl' module is compiled with 'LibreSSL 2.8.3'. See: https://github.com/urllib3/urllib3/issues/3020
  warnings.warn(
Traceback (most recent call last):
  File "/tmp/run_backtest_20260109_134315.py", line 7, in <module>
    from backtest.src.report_generator import BacktestReportGenerator
  File "/Users/dongchen/Documents/AI-project/GitHub/ppsupertrend/./backtest/src/report_generator.py", line 9, in <module>
    import matplotlib.pyplot as plt
ModuleNotFoundError: No module named 'matplotlib'
