/Users/dongchen/Documents/AI-project/GitHub/ppsupertrend/venv/lib/python3.9/site-packages/urllib3/__init__.py:35: NotOpenSSLWarning: urllib3 v2 only supports OpenSSL 1.1.1+, currently the 'ssl' module is compiled with 'LibreSSL 2.8.3'. See: https://github.com/urllib3/urllib3/issues/3020
  warnings.warn(
2026-01-09 13:37:43,101 - INFO - Downloading GBP_USD data for timeframes: ['M15', 'H3']
2026-01-09 13:37:43,101 - INFO - Downloading GBP_USD data for timeframes: ['M15', 'H3']
2026-01-09 13:37:43,101 - INFO - 
--- Downloading M15 data ---
2026-01-09 13:37:43,101 - INFO - 
--- Downloading M15 data ---
2026-01-09 13:37:43,101 - INFO - Downloading recent GBP_USD M15 data...
2026-01-09 13:37:43,101 - INFO - Downloading recent GBP_USD M15 data...
2026-01-09 13:37:43,101 - INFO - Requesting 2880 recent candles
2026-01-09 13:37:43,101 - INFO - Requesting 2880 recent candles
2026-01-09 13:37:43,853 - INFO - Downloaded 2879 candles from 2025-11-26 21:30:00+00:00 to 2026-01-09 21:15:00+00:00
2026-01-09 13:37:43,853 - INFO - Downloaded 2879 candles from 2025-11-26 21:30:00+00:00 to 2026-01-09 21:15:00+00:00
2026-01-09 13:37:43,866 - INFO - Data cached to backtest/data/GBP_USD_M15_20251210_20260109.csv
2026-01-09 13:37:43,866 - INFO - Data cached to backtest/data/GBP_USD_M15_20251210_20260109.csv
2026-01-09 13:37:43,867 - INFO - ✓ M15: 2879 candles
2026-01-09 13:37:43,867 - INFO - ✓ M15: 2879 candles
2026-01-09 13:37:43,867 - INFO - 
--- Downloading H3 data ---
2026-01-09 13:37:43,867 - INFO - 
--- Downloading H3 data ---
2026-01-09 13:37:43,867 - INFO - Downloading recent GBP_USD H3 data...
2026-01-09 13:37:43,867 - INFO - Downloading recent GBP_USD H3 data...
2026-01-09 13:37:43,867 - INFO - Requesting 240 recent candles
2026-01-09 13:37:43,867 - INFO - Requesting 240 recent candles
2026-01-09 13:37:44,064 - INFO - Downloaded 239 candles from 2025-11-26 22:00:00+00:00 to 2026-01-09 16:00:00+00:00
2026-01-09 13:37:44,064 - INFO - Downloaded 239 candles from 2025-11-26 22:00:00+00:00 to 2026-01-09 16:00:00+00:00
2026-01-09 13:37:44,066 - INFO - Data cached to backtest/data/GBP_USD_H3_20251210_20260109.csv
2026-01-09 13:37:44,066 - INFO - Data cached to backtest/data/GBP_USD_H3_20251210_20260109.csv
2026-01-09 13:37:44,066 - INFO - ✓ H3: 239 candles
2026-01-09 13:37:44,066 - INFO - ✓ H3: 239 candles

==================================================
DOWNLOAD SUMMARY
==================================================
M15: 2879 candles (2025-11-26 21:30:00+00:00 to 2026-01-09 21:15:00+00:00)
H3: 239 candles (2025-11-26 22:00:00+00:00 to 2026-01-09 16:00:00+00:00)
/Users/dongchen/Documents/AI-project/GitHub/ppsupertrend/venv/lib/python3.9/site-packages/urllib3/__init__.py:35: NotOpenSSLWarning: urllib3 v2 only supports OpenSSL 1.1.1+, currently the 'ssl' module is compiled with 'LibreSSL 2.8.3'. See: https://github.com/urllib3/urllib3/issues/3020
  warnings.warn(
2026-01-09 13:37:44,343 - INFO - Downloading GBP_USD data for timeframes: ['M15', 'H3']
2026-01-09 13:37:44,343 - INFO - Downloading GBP_USD data for timeframes: ['M15', 'H3']
2026-01-09 13:37:44,343 - INFO - 
--- Downloading M15 data ---
2026-01-09 13:37:44,343 - INFO - 
--- Downloading M15 data ---
2026-01-09 13:37:44,344 - INFO - Loading cached data from backtest/data/GBP_USD_M15_20251210_20260109.csv
2026-01-09 13:37:44,344 - INFO - Loading cached data from backtest/data/GBP_USD_M15_20251210_20260109.csv
2026-01-09 13:37:44,355 - INFO - ✓ M15: 2879 candles
2026-01-09 13:37:44,355 - INFO - ✓ M15: 2879 candles
2026-01-09 13:37:44,355 - INFO - 
--- Downloading H3 data ---
2026-01-09 13:37:44,355 - INFO - 
--- Downloading H3 data ---
2026-01-09 13:37:44,355 - INFO - Loading cached data from backtest/data/GBP_USD_H3_20251210_20260109.csv
2026-01-09 13:37:44,355 - INFO - Loading cached data from backtest/data/GBP_USD_H3_20251210_20260109.csv
2026-01-09 13:37:44,356 - INFO - ✓ H3: 239 candles
2026-01-09 13:37:44,356 - INFO - ✓ H3: 239 candles
2026-01-09 13:37:44,361 - INFO - Starting backtest for GBP_USD 15m
2026-01-09 13:37:44,361 - INFO - Starting backtest for GBP_USD 15m
2026-01-09 13:37:44,361 - INFO - Trading data: 2879 candles
2026-01-09 13:37:44,361 - INFO - Trading data: 2879 candles
2026-01-09 13:37:44,361 - INFO - Market data: 239 candles
2026-01-09 13:37:44,361 - INFO - Market data: 239 candles
2026-01-09 13:37:44,361 - INFO - Backtest period: 2025-11-26 21:30:00+00:00 to 2026-01-09 21:15:00+00:00
2026-01-09 13:37:44,361 - INFO - Backtest period: 2025-11-26 21:30:00+00:00 to 2026-01-09 21:15:00+00:00
2026-01-09 13:37:44,361 - INFO - Calculating indicators...
2026-01-09 13:37:44,361 - INFO - Calculating indicators...
2026-01-09 13:37:45,926 - INFO - OPENED SHORT | Price: 1.32400 | SL: 1.32668 | TP: 1.32132 | Size: 37,255 | Market: NEUTRAL
2026-01-09 13:37:45,926 - INFO - OPENED SHORT | Price: 1.32400 | SL: 1.32668 | TP: 1.32132 | Size: 37,255 | Market: NEUTRAL
2026-01-09 13:37:45,927 - INFO - CLOSED SHORT | P/L: $100.00 | Reason: TAKE_PROFIT | Duration: 105m
2026-01-09 13:37:45,927 - INFO - CLOSED SHORT | P/L: $100.00 | Reason: TAKE_PROFIT | Duration: 105m
2026-01-09 13:37:45,934 - INFO - OPENED LONG | Price: 1.32467 | SL: 1.32181 | TP: 1.32753 | Size: 34,996 | Market: NEUTRAL
2026-01-09 13:37:45,934 - INFO - OPENED LONG | Price: 1.32467 | SL: 1.32181 | TP: 1.32753 | Size: 34,996 | Market: NEUTRAL
2026-01-09 13:37:45,949 - INFO - CLOSED LONG | P/L: $-54.59 | Reason: SIGNAL_REVERSAL | Duration: 840m
2026-01-09 13:37:45,949 - INFO - CLOSED LONG | P/L: $-54.59 | Reason: SIGNAL_REVERSAL | Duration: 840m
2026-01-09 13:37:45,949 - INFO - OPENED SHORT | Price: 1.32311 | SL: 1.32492 | TP: 1.32130 | Size: 55,376 | Market: NEUTRAL
2026-01-09 13:37:45,949 - INFO - OPENED SHORT | Price: 1.32311 | SL: 1.32492 | TP: 1.32130 | Size: 55,376 | Market: NEUTRAL
2026-01-09 13:37:45,951 - INFO - CLOSED SHORT | P/L: $100.00 | Reason: TAKE_PROFIT | Duration: 150m
2026-01-09 13:37:45,951 - INFO - CLOSED SHORT | P/L: $100.00 | Reason: TAKE_PROFIT | Duration: 150m
2026-01-09 13:37:45,960 - INFO - OPENED LONG | Price: 1.32513 | SL: 1.31971 | TP: 1.33055 | Size: 18,464 | Market: NEUTRAL
2026-01-09 13:37:45,960 - INFO - OPENED LONG | Price: 1.32513 | SL: 1.31971 | TP: 1.33055 | Size: 18,464 | Market: NEUTRAL
2026-01-09 13:37:45,967 - INFO - CLOSED LONG | P/L: $-45.05 | Reason: SIGNAL_REVERSAL | Duration: 3255m
2026-01-09 13:37:45,967 - INFO - CLOSED LONG | P/L: $-45.05 | Reason: SIGNAL_REVERSAL | Duration: 3255m
2026-01-09 13:37:45,967 - INFO - OPENED SHORT | Price: 1.32269 | SL: 1.32490 | TP: 1.32048 | Size: 45,154 | Market: NEUTRAL
2026-01-09 13:37:45,967 - INFO - OPENED SHORT | Price: 1.32269 | SL: 1.32490 | TP: 1.32048 | Size: 45,154 | Market: NEUTRAL
2026-01-09 13:37:45,968 - INFO - CLOSED SHORT | P/L: $-95.73 | Reason: SIGNAL_REVERSAL | Duration: 60m
2026-01-09 13:37:45,968 - INFO - CLOSED SHORT | P/L: $-95.73 | Reason: SIGNAL_REVERSAL | Duration: 60m
2026-01-09 13:37:45,969 - INFO - OPENED LONG | Price: 1.32481 | SL: 1.32199 | TP: 1.32763 | Size: 35,399 | Market: NEUTRAL
2026-01-09 13:37:45,969 - INFO - OPENED LONG | Price: 1.32481 | SL: 1.32199 | TP: 1.32763 | Size: 35,399 | Market: NEUTRAL
2026-01-09 13:37:45,976 - INFO - CLOSED LONG | P/L: $-99.47 | Reason: SIGNAL_REVERSAL | Duration: 420m
2026-01-09 13:37:45,976 - INFO - CLOSED LONG | P/L: $-99.47 | Reason: SIGNAL_REVERSAL | Duration: 420m
2026-01-09 13:37:45,976 - INFO - OPENED SHORT | Price: 1.32200 | SL: 1.32458 | TP: 1.31942 | Size: 38,731 | Market: NEUTRAL
2026-01-09 13:37:45,976 - INFO - OPENED SHORT | Price: 1.32200 | SL: 1.32458 | TP: 1.31942 | Size: 38,731 | Market: NEUTRAL
2026-01-09 13:37:45,984 - INFO - CLOSED SHORT | P/L: $-98.38 | Reason: SIGNAL_REVERSAL | Duration: 375m
2026-01-09 13:37:45,984 - INFO - CLOSED SHORT | P/L: $-98.38 | Reason: SIGNAL_REVERSAL | Duration: 375m
2026-01-09 13:37:45,984 - INFO - OPENED LONG | Price: 1.32454 | SL: 1.32050 | TP: 1.32858 | Size: 24,754 | Market: NEUTRAL
2026-01-09 13:37:45,984 - INFO - OPENED LONG | Price: 1.32454 | SL: 1.32050 | TP: 1.32858 | Size: 24,754 | Market: NEUTRAL
2026-01-09 13:37:45,990 - INFO - CLOSED LONG | P/L: $-76.98 | Reason: SIGNAL_REVERSAL | Duration: 360m
2026-01-09 13:37:45,990 - INFO - CLOSED LONG | P/L: $-76.98 | Reason: SIGNAL_REVERSAL | Duration: 360m
2026-01-09 13:37:45,990 - INFO - OPENED SHORT | Price: 1.32143 | SL: 1.32569 | TP: 1.31717 | Size: 23,460 | Market: NEUTRAL
2026-01-09 13:37:45,990 - INFO - OPENED SHORT | Price: 1.32143 | SL: 1.32569 | TP: 1.31717 | Size: 23,460 | Market: NEUTRAL
2026-01-09 13:37:46,002 - INFO - CLOSED SHORT | P/L: $-13.37 | Reason: SIGNAL_REVERSAL | Duration: 585m
2026-01-09 13:37:46,002 - INFO - CLOSED SHORT | P/L: $-13.37 | Reason: SIGNAL_REVERSAL | Duration: 585m
2026-01-09 13:37:46,002 - INFO - OPENED LONG | Price: 1.32200 | SL: 1.32043 | TP: 1.32357 | Size: 63,692 | Market: NEUTRAL
2026-01-09 13:37:46,002 - INFO - OPENED LONG | Price: 1.32200 | SL: 1.32043 | TP: 1.32357 | Size: 63,692 | Market: NEUTRAL
2026-01-09 13:37:46,008 - INFO - CLOSED LONG | P/L: $-100.00 | Reason: STOP_LOSS | Duration: 360m
2026-01-09 13:37:46,008 - INFO - CLOSED LONG | P/L: $-100.00 | Reason: STOP_LOSS | Duration: 360m
2026-01-09 13:37:46,008 - INFO - OPENED SHORT | Price: 1.31958 | SL: 1.32235 | TP: 1.31681 | Size: 36,065 | Market: NEUTRAL
2026-01-09 13:37:46,008 - INFO - OPENED SHORT | Price: 1.31958 | SL: 1.32235 | TP: 1.31681 | Size: 36,065 | Market: NEUTRAL
2026-01-09 13:37:46,023 - INFO - CLOSED SHORT | P/L: $-88.00 | Reason: SIGNAL_REVERSAL | Duration: 810m
2026-01-09 13:37:46,023 - INFO - CLOSED SHORT | P/L: $-88.00 | Reason: SIGNAL_REVERSAL | Duration: 810m
2026-01-09 13:37:46,023 - INFO - OPENED LONG | Price: 1.32202 | SL: 1.31948 | TP: 1.32456 | Size: 39,386 | Market: NEUTRAL
2026-01-09 13:37:46,023 - INFO - OPENED LONG | Price: 1.32202 | SL: 1.31948 | TP: 1.32456 | Size: 39,386 | Market: NEUTRAL
2026-01-09 13:37:46,031 - INFO - CLOSED LONG | P/L: $100.00 | Reason: TAKE_PROFIT | Duration: 450m
2026-01-09 13:37:46,031 - INFO - CLOSED LONG | P/L: $100.00 | Reason: TAKE_PROFIT | Duration: 450m
2026-01-09 13:37:46,052 - INFO - OPENED SHORT | Price: 1.33372 | SL: 1.33524 | TP: 1.33220 | Size: 65,827 | Market: NEUTRAL
2026-01-09 13:37:46,052 - INFO - OPENED SHORT | Price: 1.33372 | SL: 1.33524 | TP: 1.33220 | Size: 65,827 | Market: NEUTRAL
2026-01-09 13:37:46,059 - INFO - CLOSED SHORT | P/L: $-100.00 | Reason: STOP_LOSS | Duration: 375m
2026-01-09 13:37:46,059 - INFO - CLOSED SHORT | P/L: $-100.00 | Reason: STOP_LOSS | Duration: 375m
2026-01-09 13:37:46,059 - INFO - OPENED LONG | Price: 1.33567 | SL: 1.33271 | TP: 1.33863 | Size: 33,776 | Market: NEUTRAL
2026-01-09 13:37:46,059 - INFO - OPENED LONG | Price: 1.33567 | SL: 1.33271 | TP: 1.33863 | Size: 33,776 | Market: NEUTRAL
2026-01-09 13:37:46,072 - INFO - CLOSED LONG | P/L: $-79.37 | Reason: SIGNAL_REVERSAL | Duration: 720m
2026-01-09 13:37:46,072 - INFO - CLOSED LONG | P/L: $-79.37 | Reason: SIGNAL_REVERSAL | Duration: 720m
2026-01-09 13:37:46,072 - INFO - OPENED SHORT | Price: 1.33332 | SL: 1.33669 | TP: 1.32995 | Size: 29,702 | Market: NEUTRAL
2026-01-09 13:37:46,072 - INFO - OPENED SHORT | Price: 1.33332 | SL: 1.33669 | TP: 1.32995 | Size: 29,702 | Market: NEUTRAL
2026-01-09 13:37:46,106 - INFO - CLOSED SHORT | P/L: $-10.99 | Reason: SIGNAL_REVERSAL | Duration: 525m
2026-01-09 13:37:46,106 - INFO - CLOSED SHORT | P/L: $-10.99 | Reason: SIGNAL_REVERSAL | Duration: 525m
2026-01-09 13:37:46,106 - INFO - OPENED LONG | Price: 1.33369 | SL: 1.33214 | TP: 1.33555 | Size: 77,517 | Market: BULL
2026-01-09 13:37:46,106 - INFO - OPENED LONG | Price: 1.33369 | SL: 1.33214 | TP: 1.33555 | Size: 77,517 | Market: BULL
2026-01-09 13:37:46,134 - INFO - CLOSED LONG | P/L: $144.00 | Reason: TAKE_PROFIT | Duration: 135m
2026-01-09 13:37:46,134 - INFO - CLOSED LONG | P/L: $144.00 | Reason: TAKE_PROFIT | Duration: 135m
2026-01-09 13:37:46,221 - INFO - OPENED SHORT | Price: 1.33229 | SL: 1.33603 | TP: 1.33005 | Size: 21,384 | Market: BULL
2026-01-09 13:37:46,221 - INFO - OPENED SHORT | Price: 1.33229 | SL: 1.33603 | TP: 1.33005 | Size: 21,384 | Market: BULL
2026-01-09 13:37:46,570 - INFO - CLOSED SHORT | P/L: $-21.60 | Reason: SIGNAL_REVERSAL | Duration: 4905m
2026-01-09 13:37:46,570 - INFO - CLOSED SHORT | P/L: $-21.60 | Reason: SIGNAL_REVERSAL | Duration: 4905m
2026-01-09 13:37:46,570 - INFO - OPENED LONG | Price: 1.33330 | SL: 1.33134 | TP: 1.33566 | Size: 61,144 | Market: BULL
2026-01-09 13:37:46,570 - INFO - OPENED LONG | Price: 1.33330 | SL: 1.33134 | TP: 1.33566 | Size: 61,144 | Market: BULL
2026-01-09 13:37:46,712 - INFO - CLOSED LONG | P/L: $-97.83 | Reason: SIGNAL_REVERSAL | Duration: 645m
2026-01-09 13:37:46,712 - INFO - CLOSED LONG | P/L: $-97.83 | Reason: SIGNAL_REVERSAL | Duration: 645m
2026-01-09 13:37:46,713 - INFO - OPENED SHORT | Price: 1.33170 | SL: 1.33607 | TP: 1.32908 | Size: 18,315 | Market: BULL
2026-01-09 13:37:46,713 - INFO - OPENED SHORT | Price: 1.33170 | SL: 1.33607 | TP: 1.32908 | Size: 18,315 | Market: BULL
2026-01-09 13:37:46,905 - INFO - CLOSED SHORT | P/L: $12.64 | Reason: SIGNAL_REVERSAL | Duration: 1050m
2026-01-09 13:37:46,905 - INFO - CLOSED SHORT | P/L: $12.64 | Reason: SIGNAL_REVERSAL | Duration: 1050m
2026-01-09 13:37:46,905 - INFO - OPENED LONG | Price: 1.33101 | SL: 1.32923 | TP: 1.33314 | Size: 67,537 | Market: BULL
2026-01-09 13:37:46,905 - INFO - OPENED LONG | Price: 1.33101 | SL: 1.32923 | TP: 1.33314 | Size: 67,537 | Market: BULL
2026-01-09 13:37:47,072 - INFO - CLOSED LONG | P/L: $144.00 | Reason: TAKE_PROFIT | Duration: 630m
2026-01-09 13:37:47,072 - INFO - CLOSED LONG | P/L: $144.00 | Reason: TAKE_PROFIT | Duration: 630m
2026-01-09 13:37:47,244 - INFO - OPENED SHORT | Price: 1.33618 | SL: 1.33851 | TP: 1.33478 | Size: 34,352 | Market: BULL
2026-01-09 13:37:47,244 - INFO - OPENED SHORT | Price: 1.33618 | SL: 1.33851 | TP: 1.33478 | Size: 34,352 | Market: BULL
2026-01-09 13:37:47,287 - INFO - Progress: 34.7% (1000/2879)
2026-01-09 13:37:47,287 - INFO - Progress: 34.7% (1000/2879)
2026-01-09 13:37:47,333 - INFO - CLOSED SHORT | P/L: $-78.32 | Reason: SIGNAL_REVERSAL | Duration: 345m
2026-01-09 13:37:47,333 - INFO - CLOSED SHORT | P/L: $-78.32 | Reason: SIGNAL_REVERSAL | Duration: 345m
2026-01-09 13:37:47,334 - INFO - OPENED LONG | Price: 1.33846 | SL: 1.33432 | TP: 1.34343 | Size: 28,969 | Market: BULL
2026-01-09 13:37:47,334 - INFO - OPENED LONG | Price: 1.33846 | SL: 1.33432 | TP: 1.34343 | Size: 28,969 | Market: BULL
2026-01-09 13:37:47,422 - INFO - CLOSED LONG | P/L: $144.00 | Reason: TAKE_PROFIT | Duration: 255m
2026-01-09 13:37:47,422 - INFO - CLOSED LONG | P/L: $144.00 | Reason: TAKE_PROFIT | Duration: 255m
2026-01-09 13:37:47,471 - INFO - OPENED SHORT | Price: 1.33904 | SL: 1.34369 | TP: 1.33625 | Size: 17,202 | Market: BULL
2026-01-09 13:37:47,471 - INFO - OPENED SHORT | Price: 1.33904 | SL: 1.34369 | TP: 1.33625 | Size: 17,202 | Market: BULL
2026-01-09 13:37:47,805 - INFO - CLOSED SHORT | P/L: $48.00 | Reason: TAKE_PROFIT | Duration: 1185m
2026-01-09 13:37:47,805 - INFO - CLOSED SHORT | P/L: $48.00 | Reason: TAKE_PROFIT | Duration: 1185m
2026-01-09 13:37:48,063 - INFO - OPENED LONG | Price: 1.33808 | SL: 1.33506 | TP: 1.34171 | Size: 39,708 | Market: BULL
2026-01-09 13:37:48,063 - INFO - OPENED LONG | Price: 1.33808 | SL: 1.33506 | TP: 1.34171 | Size: 39,708 | Market: BULL
2026-01-09 13:37:48,220 - INFO - CLOSED LONG | P/L: $-50.03 | Reason: SIGNAL_REVERSAL | Duration: 510m
2026-01-09 13:37:48,220 - INFO - CLOSED LONG | P/L: $-50.03 | Reason: SIGNAL_REVERSAL | Duration: 510m
2026-01-09 13:37:48,220 - INFO - OPENED SHORT | Price: 1.33682 | SL: 1.34106 | TP: 1.33428 | Size: 18,860 | Market: BULL
2026-01-09 13:37:48,220 - INFO - OPENED SHORT | Price: 1.33682 | SL: 1.34106 | TP: 1.33428 | Size: 18,860 | Market: BULL
2026-01-09 13:37:48,484 - INFO - CLOSED SHORT | P/L: $-28.29 | Reason: SIGNAL_REVERSAL | Duration: 870m
2026-01-09 13:37:48,484 - INFO - CLOSED SHORT | P/L: $-28.29 | Reason: SIGNAL_REVERSAL | Duration: 870m
2026-01-09 13:37:48,484 - INFO - OPENED LONG | Price: 1.33832 | SL: 1.33519 | TP: 1.34208 | Size: 38,313 | Market: BULL
2026-01-09 13:37:48,484 - INFO - OPENED LONG | Price: 1.33832 | SL: 1.33519 | TP: 1.34208 | Size: 38,313 | Market: BULL
2026-01-09 13:37:48,537 - INFO - CLOSED LONG | P/L: $144.00 | Reason: TAKE_PROFIT | Duration: 150m
2026-01-09 13:37:48,537 - INFO - CLOSED LONG | P/L: $144.00 | Reason: TAKE_PROFIT | Duration: 150m
2026-01-09 13:37:48,800 - INFO - OPENED SHORT | Price: 1.34132 | SL: 1.34318 | TP: 1.34020 | Size: 42,989 | Market: BULL
2026-01-09 13:37:48,800 - INFO - OPENED SHORT | Price: 1.34132 | SL: 1.34318 | TP: 1.34020 | Size: 42,989 | Market: BULL
2026-01-09 13:37:48,852 - INFO - CLOSED SHORT | P/L: $48.00 | Reason: TAKE_PROFIT | Duration: 135m
2026-01-09 13:37:48,852 - INFO - CLOSED SHORT | P/L: $48.00 | Reason: TAKE_PROFIT | Duration: 135m
2026-01-09 13:37:49,011 - INFO - OPENED LONG | Price: 1.33563 | SL: 1.33231 | TP: 1.33961 | Size: 36,147 | Market: BULL
2026-01-09 13:37:49,011 - INFO - OPENED LONG | Price: 1.33563 | SL: 1.33231 | TP: 1.33961 | Size: 36,147 | Market: BULL
2026-01-09 13:37:49,064 - INFO - CLOSED LONG | P/L: $144.00 | Reason: TAKE_PROFIT | Duration: 120m
2026-01-09 13:37:49,064 - INFO - CLOSED LONG | P/L: $144.00 | Reason: TAKE_PROFIT | Duration: 120m
2026-01-09 13:37:49,223 - INFO - OPENED SHORT | Price: 1.33647 | SL: 1.33866 | TP: 1.33515 | Size: 36,494 | Market: BULL
2026-01-09 13:37:49,223 - INFO - OPENED SHORT | Price: 1.33647 | SL: 1.33866 | TP: 1.33515 | Size: 36,494 | Market: BULL
2026-01-09 13:37:49,380 - INFO - CLOSED SHORT | P/L: $48.00 | Reason: TAKE_PROFIT | Duration: 450m
2026-01-09 13:37:49,380 - INFO - CLOSED SHORT | P/L: $48.00 | Reason: TAKE_PROFIT | Duration: 450m
2026-01-09 13:37:49,383 - INFO - OPENED LONG | Price: 1.33772 | SL: 1.33402 | TP: 1.34216 | Size: 32,406 | Market: BULL
2026-01-09 13:37:49,383 - INFO - OPENED LONG | Price: 1.33772 | SL: 1.33402 | TP: 1.34216 | Size: 32,406 | Market: BULL
2026-01-09 13:37:49,436 - INFO - CLOSED LONG | P/L: $144.00 | Reason: TAKE_PROFIT | Duration: 105m
2026-01-09 13:37:49,436 - INFO - CLOSED LONG | P/L: $144.00 | Reason: TAKE_PROFIT | Duration: 105m
2026-01-09 13:37:49,707 - INFO - OPENED SHORT | Price: 1.33715 | SL: 1.33935 | TP: 1.33583 | Size: 36,444 | Market: BULL
2026-01-09 13:37:49,707 - INFO - OPENED SHORT | Price: 1.33715 | SL: 1.33935 | TP: 1.33583 | Size: 36,444 | Market: BULL
2026-01-09 13:37:49,983 - INFO - CLOSED SHORT | P/L: $-59.40 | Reason: SIGNAL_REVERSAL | Duration: 840m
2026-01-09 13:37:49,983 - INFO - CLOSED SHORT | P/L: $-59.40 | Reason: SIGNAL_REVERSAL | Duration: 840m
2026-01-09 13:37:49,983 - INFO - OPENED LONG | Price: 1.33878 | SL: 1.33443 | TP: 1.34400 | Size: 27,605 | Market: BULL
2026-01-09 13:37:49,983 - INFO - OPENED LONG | Price: 1.33878 | SL: 1.33443 | TP: 1.34400 | Size: 27,605 | Market: BULL
2026-01-09 13:37:50,305 - INFO - CLOSED LONG | P/L: $144.00 | Reason: TAKE_PROFIT | Duration: 3915m
2026-01-09 13:37:50,305 - INFO - CLOSED LONG | P/L: $144.00 | Reason: TAKE_PROFIT | Duration: 3915m
2026-01-09 13:37:50,791 - INFO - OPENED SHORT | Price: 1.34842 | SL: 1.35271 | TP: 1.34585 | Size: 18,669 | Market: BULL
2026-01-09 13:37:50,791 - INFO - OPENED SHORT | Price: 1.34842 | SL: 1.35271 | TP: 1.34585 | Size: 18,669 | Market: BULL
2026-01-09 13:37:50,897 - INFO - CLOSED SHORT | P/L: $-28.19 | Reason: SIGNAL_REVERSAL | Duration: 360m
2026-01-09 13:37:50,897 - INFO - CLOSED SHORT | P/L: $-28.19 | Reason: SIGNAL_REVERSAL | Duration: 360m
2026-01-09 13:37:50,898 - INFO - OPENED LONG | Price: 1.34993 | SL: 1.34710 | TP: 1.35333 | Size: 42,364 | Market: BULL
2026-01-09 13:37:50,898 - INFO - OPENED LONG | Price: 1.34993 | SL: 1.34710 | TP: 1.35333 | Size: 42,364 | Market: BULL
2026-01-09 13:37:51,108 - INFO - CLOSED LONG | P/L: $30.08 | Reason: SIGNAL_REVERSAL | Duration: 690m
2026-01-09 13:37:51,108 - INFO - CLOSED LONG | P/L: $30.08 | Reason: SIGNAL_REVERSAL | Duration: 690m
2026-01-09 13:37:51,108 - INFO - OPENED SHORT | Price: 1.35064 | SL: 1.35265 | TP: 1.34944 | Size: 39,892 | Market: BULL
2026-01-09 13:37:51,108 - INFO - OPENED SHORT | Price: 1.35064 | SL: 1.35265 | TP: 1.34944 | Size: 39,892 | Market: BULL
2026-01-09 13:37:51,109 - INFO - CLOSED SHORT | P/L: $-77.39 | Reason: SIGNAL_REVERSAL | Duration: 45m
2026-01-09 13:37:51,109 - INFO - CLOSED SHORT | P/L: $-77.39 | Reason: SIGNAL_REVERSAL | Duration: 45m
2026-01-09 13:37:51,109 - INFO - OPENED LONG | Price: 1.35258 | SL: 1.34939 | TP: 1.35641 | Size: 37,573 | Market: BULL
2026-01-09 13:37:51,109 - INFO - OPENED LONG | Price: 1.35258 | SL: 1.34939 | TP: 1.35641 | Size: 37,573 | Market: BULL
2026-01-09 13:37:51,215 - INFO - CLOSED LONG | P/L: $-108.96 | Reason: SIGNAL_REVERSAL | Duration: 345m
2026-01-09 13:37:51,215 - INFO - CLOSED LONG | P/L: $-108.96 | Reason: SIGNAL_REVERSAL | Duration: 345m
2026-01-09 13:37:51,215 - INFO - OPENED SHORT | Price: 1.34968 | SL: 1.35260 | TP: 1.34793 | Size: 27,371 | Market: BULL
2026-01-09 13:37:51,215 - INFO - OPENED SHORT | Price: 1.34968 | SL: 1.35260 | TP: 1.34793 | Size: 27,371 | Market: BULL
2026-01-09 13:37:51,372 - INFO - CLOSED SHORT | P/L: $-58.85 | Reason: SIGNAL_REVERSAL | Duration: 1875m
2026-01-09 13:37:51,372 - INFO - CLOSED SHORT | P/L: $-58.85 | Reason: SIGNAL_REVERSAL | Duration: 1875m
2026-01-09 13:37:51,372 - INFO - OPENED LONG | Price: 1.35183 | SL: 1.34947 | TP: 1.35466 | Size: 50,902 | Market: BULL
2026-01-09 13:37:51,372 - INFO - OPENED LONG | Price: 1.35183 | SL: 1.34947 | TP: 1.35466 | Size: 50,902 | Market: BULL
2026-01-09 13:37:51,478 - INFO - CLOSED LONG | P/L: $-92.13 | Reason: SIGNAL_REVERSAL | Duration: 405m
2026-01-09 13:37:51,478 - INFO - CLOSED LONG | P/L: $-92.13 | Reason: SIGNAL_REVERSAL | Duration: 405m
2026-01-09 13:37:51,478 - INFO - OPENED SHORT | Price: 1.35002 | SL: 1.35234 | TP: 1.34863 | Size: 34,506 | Market: BULL
2026-01-09 13:37:51,478 - INFO - OPENED SHORT | Price: 1.35002 | SL: 1.35234 | TP: 1.34863 | Size: 34,506 | Market: BULL
2026-01-09 13:37:51,531 - INFO - CLOSED SHORT | P/L: $48.00 | Reason: TAKE_PROFIT | Duration: 150m
2026-01-09 13:37:51,531 - INFO - CLOSED SHORT | P/L: $48.00 | Reason: TAKE_PROFIT | Duration: 150m
2026-01-09 13:37:51,638 - INFO - OPENED LONG | Price: 1.35148 | SL: 1.34775 | TP: 1.35595 | Size: 32,178 | Market: BULL
2026-01-09 13:37:51,638 - INFO - OPENED LONG | Price: 1.35148 | SL: 1.34775 | TP: 1.35595 | Size: 32,178 | Market: BULL
2026-01-09 13:37:51,692 - INFO - Progress: 69.5% (2000/2879)
2026-01-09 13:37:51,692 - INFO - Progress: 69.5% (2000/2879)
2026-01-09 13:37:51,902 - INFO - CLOSED LONG | P/L: $-86.56 | Reason: SIGNAL_REVERSAL | Duration: 3825m
2026-01-09 13:37:51,902 - INFO - CLOSED LONG | P/L: $-86.56 | Reason: SIGNAL_REVERSAL | Duration: 3825m
2026-01-09 13:37:51,902 - INFO - OPENED SHORT | Price: 1.34879 | SL: 1.35157 | TP: 1.34712 | Size: 28,820 | Market: BULL
2026-01-09 13:37:51,902 - INFO - OPENED SHORT | Price: 1.34879 | SL: 1.35157 | TP: 1.34712 | Size: 28,820 | Market: BULL
2026-01-09 13:37:52,183 - INFO - CLOSED SHORT | P/L: $-69.46 | Reason: SIGNAL_REVERSAL | Duration: 975m
2026-01-09 13:37:52,183 - INFO - CLOSED SHORT | P/L: $-69.46 | Reason: SIGNAL_REVERSAL | Duration: 975m
2026-01-09 13:37:52,184 - INFO - OPENED LONG | Price: 1.35120 | SL: 1.34862 | TP: 1.35430 | Size: 46,509 | Market: BULL
2026-01-09 13:37:52,184 - INFO - OPENED LONG | Price: 1.35120 | SL: 1.34862 | TP: 1.35430 | Size: 46,509 | Market: BULL
2026-01-09 13:37:52,505 - INFO - CLOSED LONG | P/L: $-70.69 | Reason: SIGNAL_REVERSAL | Duration: 930m
2026-01-09 13:37:52,505 - INFO - CLOSED LONG | P/L: $-70.69 | Reason: SIGNAL_REVERSAL | Duration: 930m
2026-01-09 13:37:52,505 - INFO - OPENED SHORT | Price: 1.34968 | SL: 1.35344 | TP: 1.34742 | Size: 21,283 | Market: BULL
2026-01-09 13:37:52,505 - INFO - OPENED SHORT | Price: 1.34968 | SL: 1.35344 | TP: 1.34742 | Size: 21,283 | Market: BULL
2026-01-09 13:37:52,507 - INFO - CLOSED SHORT | P/L: $48.00 | Reason: TAKE_PROFIT | Duration: 105m
2026-01-09 13:37:52,507 - INFO - CLOSED SHORT | P/L: $48.00 | Reason: TAKE_PROFIT | Duration: 105m
2026-01-09 13:37:52,922 - INFO - OPENED LONG | Price: 1.34672 | SL: 1.34265 | TP: 1.34916 | Size: 19,641 | Market: BEAR
2026-01-09 13:37:52,922 - INFO - OPENED LONG | Price: 1.34672 | SL: 1.34265 | TP: 1.34916 | Size: 19,641 | Market: BEAR
2026-01-09 13:37:52,924 - INFO - CLOSED LONG | P/L: $-80.00 | Reason: STOP_LOSS | Duration: 135m
2026-01-09 13:37:52,924 - INFO - CLOSED LONG | P/L: $-80.00 | Reason: STOP_LOSS | Duration: 135m
2026-01-09 13:37:52,925 - INFO - OPENED SHORT | Price: 1.34096 | SL: 1.34733 | TP: 1.33331 | Size: 18,827 | Market: BEAR
2026-01-09 13:37:52,925 - INFO - OPENED SHORT | Price: 1.34096 | SL: 1.34733 | TP: 1.33331 | Size: 18,827 | Market: BEAR
2026-01-09 13:37:53,030 - INFO - CLOSED SHORT | P/L: $-111.46 | Reason: SIGNAL_REVERSAL | Duration: 300m
2026-01-09 13:37:53,030 - INFO - CLOSED SHORT | P/L: $-111.46 | Reason: SIGNAL_REVERSAL | Duration: 300m
2026-01-09 13:37:53,030 - INFO - OPENED LONG | Price: 1.34688 | SL: 1.34311 | TP: 1.34914 | Size: 21,239 | Market: BEAR
2026-01-09 13:37:53,030 - INFO - OPENED LONG | Price: 1.34688 | SL: 1.34311 | TP: 1.34914 | Size: 21,239 | Market: BEAR
2026-01-09 13:37:53,188 - INFO - CLOSED LONG | P/L: $5.10 | Reason: SIGNAL_REVERSAL | Duration: 2025m
2026-01-09 13:37:53,188 - INFO - CLOSED LONG | P/L: $5.10 | Reason: SIGNAL_REVERSAL | Duration: 2025m
2026-01-09 13:37:53,188 - INFO - OPENED SHORT | Price: 1.34712 | SL: 1.34917 | TP: 1.34466 | Size: 58,459 | Market: BEAR
2026-01-09 13:37:53,188 - INFO - OPENED SHORT | Price: 1.34712 | SL: 1.34917 | TP: 1.34466 | Size: 58,459 | Market: BEAR
2026-01-09 13:37:53,292 - INFO - CLOSED SHORT | P/L: $144.00 | Reason: TAKE_PROFIT | Duration: 270m
2026-01-09 13:37:53,292 - INFO - CLOSED SHORT | P/L: $144.00 | Reason: TAKE_PROFIT | Duration: 270m
2026-01-09 13:37:53,347 - INFO - OPENED LONG | Price: 1.34756 | SL: 1.34279 | TP: 1.35042 | Size: 16,787 | Market: BEAR
2026-01-09 13:37:53,347 - INFO - OPENED LONG | Price: 1.34756 | SL: 1.34279 | TP: 1.35042 | Size: 16,787 | Market: BEAR
2026-01-09 13:37:53,504 - INFO - CLOSED LONG | P/L: $-59.09 | Reason: SIGNAL_REVERSAL | Duration: 3390m
2026-01-09 13:37:53,504 - INFO - CLOSED LONG | P/L: $-59.09 | Reason: SIGNAL_REVERSAL | Duration: 3390m
2026-01-09 13:37:53,504 - INFO - OPENED SHORT | Price: 1.34404 | SL: 1.34726 | TP: 1.34018 | Size: 37,312 | Market: BEAR
2026-01-09 13:37:53,504 - INFO - OPENED SHORT | Price: 1.34404 | SL: 1.34726 | TP: 1.34018 | Size: 37,312 | Market: BEAR
2026-01-09 13:37:53,713 - INFO - CLOSED SHORT | P/L: $-30.60 | Reason: SIGNAL_REVERSAL | Duration: 630m
2026-01-09 13:37:53,713 - INFO - CLOSED SHORT | P/L: $-30.60 | Reason: SIGNAL_REVERSAL | Duration: 630m
2026-01-09 13:37:53,713 - INFO - OPENED LONG | Price: 1.34486 | SL: 1.34190 | TP: 1.34663 | Size: 27,055 | Market: BEAR
2026-01-09 13:37:53,713 - INFO - OPENED LONG | Price: 1.34486 | SL: 1.34190 | TP: 1.34663 | Size: 27,055 | Market: BEAR
2026-01-09 13:37:53,714 - INFO - CLOSED LONG | P/L: $48.00 | Reason: TAKE_PROFIT | Duration: 90m
2026-01-09 13:37:53,714 - INFO - CLOSED LONG | P/L: $48.00 | Reason: TAKE_PROFIT | Duration: 90m
2026-01-09 13:37:54,138 - INFO - OPENED SHORT | Price: 1.35357 | SL: 1.35628 | TP: 1.35194 | Size: 29,512 | Market: BULL
2026-01-09 13:37:54,138 - INFO - OPENED SHORT | Price: 1.35357 | SL: 1.35628 | TP: 1.35194 | Size: 29,512 | Market: BULL
2026-01-09 13:37:54,190 - INFO - CLOSED SHORT | P/L: $48.00 | Reason: TAKE_PROFIT | Duration: 165m
2026-01-09 13:37:54,190 - INFO - CLOSED SHORT | P/L: $48.00 | Reason: TAKE_PROFIT | Duration: 165m
2026-01-09 13:37:54,402 - INFO - OPENED LONG | Price: 1.35113 | SL: 1.34917 | TP: 1.35349 | Size: 61,077 | Market: BULL
2026-01-09 13:37:54,402 - INFO - OPENED LONG | Price: 1.35113 | SL: 1.34917 | TP: 1.35349 | Size: 61,077 | Market: BULL
2026-01-09 13:37:54,507 - INFO - CLOSED LONG | P/L: $-114.21 | Reason: SIGNAL_REVERSAL | Duration: 345m
2026-01-09 13:37:54,507 - INFO - CLOSED LONG | P/L: $-114.21 | Reason: SIGNAL_REVERSAL | Duration: 345m
2026-01-09 13:37:54,507 - INFO - OPENED SHORT | Price: 1.34926 | SL: 1.35203 | TP: 1.34760 | Size: 28,836 | Market: BULL
2026-01-09 13:37:54,507 - INFO - OPENED SHORT | Price: 1.34926 | SL: 1.35203 | TP: 1.34760 | Size: 28,836 | Market: BULL
2026-01-09 13:37:54,668 - INFO - CLOSED SHORT | P/L: $48.00 | Reason: TAKE_PROFIT | Duration: 495m
2026-01-09 13:37:54,668 - INFO - CLOSED SHORT | P/L: $48.00 | Reason: TAKE_PROFIT | Duration: 495m
2026-01-09 13:37:55,261 - INFO - OPENED LONG | Price: 1.34440 | SL: 1.34168 | TP: 1.34603 | Size: 29,387 | Market: BEAR
2026-01-09 13:37:55,261 - INFO - OPENED LONG | Price: 1.34440 | SL: 1.34168 | TP: 1.34603 | Size: 29,387 | Market: BEAR
2026-01-09 13:37:55,317 - INFO - CLOSED LONG | P/L: $-55.84 | Reason: SIGNAL_REVERSAL | Duration: 270m
2026-01-09 13:37:55,317 - INFO - CLOSED LONG | P/L: $-55.84 | Reason: SIGNAL_REVERSAL | Duration: 270m
2026-01-09 13:37:55,317 - INFO - OPENED SHORT | Price: 1.34250 | SL: 1.34464 | TP: 1.33993 | Size: 55,998 | Market: BEAR
2026-01-09 13:37:55,317 - INFO - OPENED SHORT | Price: 1.34250 | SL: 1.34464 | TP: 1.33993 | Size: 55,998 | Market: BEAR
2026-01-09 13:37:55,528 - INFO - CLOSED SHORT | P/L: $-110.88 | Reason: SIGNAL_REVERSAL | Duration: 690m
2026-01-09 13:37:55,528 - INFO - CLOSED SHORT | P/L: $-110.88 | Reason: SIGNAL_REVERSAL | Duration: 690m
2026-01-09 13:37:55,528 - INFO - OPENED LONG | Price: 1.34448 | SL: 1.33972 | TP: 1.34734 | Size: 16,811 | Market: BEAR
2026-01-09 13:37:55,528 - INFO - OPENED LONG | Price: 1.34448 | SL: 1.33972 | TP: 1.34734 | Size: 16,811 | Market: BEAR
2026-01-09 13:37:55,530 - INFO - CLOSED LONG | P/L: $-78.68 | Reason: SIGNAL_REVERSAL | Duration: 90m
2026-01-09 13:37:55,530 - INFO - CLOSED LONG | P/L: $-78.68 | Reason: SIGNAL_REVERSAL | Duration: 90m
2026-01-09 13:37:55,530 - INFO - OPENED SHORT | Price: 1.33980 | SL: 1.34637 | TP: 1.33192 | Size: 18,269 | Market: BEAR
2026-01-09 13:37:55,530 - INFO - OPENED SHORT | Price: 1.33980 | SL: 1.34637 | TP: 1.33192 | Size: 18,269 | Market: BEAR
2026-01-09 13:37:55,637 - INFO - CLOSED SHORT | P/L: $-13.52 | Reason: BACKTEST_END | Duration: 375m
2026-01-09 13:37:55,637 - INFO - CLOSED SHORT | P/L: $-13.52 | Reason: BACKTEST_END | Duration: 375m
2026-01-09 13:37:55,637 - INFO - Backtest completed. Total trades: 57
2026-01-09 13:37:55,637 - INFO - Backtest completed. Total trades: 57
Downloading historical data...
Running backtest...

============================================================
BACKTEST RESULTS
============================================================
Instrument: GBP_USD
Period: 30 days
Total Trades: 57
Win Rate: 38.6%
Total Return: $-560.12
Return %: -5.60%
Profit Factor: 0.77
Final Balance: $9439.88
/Users/dongchen/Documents/AI-project/GitHub/ppsupertrend/venv/lib/python3.9/site-packages/urllib3/__init__.py:35: NotOpenSSLWarning: urllib3 v2 only supports OpenSSL 1.1.1+, currently the 'ssl' module is compiled with 'LibreSSL 2.8.3'. See: https://github.com/urllib3/urllib3/issues/3020
  warnings.warn(
Traceback (most recent call last):
  File "/tmp/run_backtest_20260109_133741.py", line 7, in <module>
    from backtest.src.report_generator import BacktestReportGenerator
  File "/Users/dongchen/Documents/AI-project/GitHub/ppsupertrend/./backtest/src/report_generator.py", line 9, in <module>
    import matplotlib.pyplot as plt
ModuleNotFoundError: No module named 'matplotlib'
